[I 2025-03-20 22:01:41,446] Trial 67 finished with value: 0.8866154074668884 and parameters: {'activation_l0': 'leaky_relu', 'n_units_l0': 75, 'dropout_l0': 0.3772926172956443, 'activation_l1': 'leaky_relu', 'n_units_l1': 39, 'dropout_l1': 0.4351362952364675, 'learning_rate': 4.031963167106694e-05}. Best is trial 53 with value: 0.8876923263072967.
[I 2025-03-20 22:01:49,097] Trial 68 finished with value: 0.8577307760715485 and parameters: {'activation_l0': 'leaky_relu', 'n_units_l0': 78, 'dropout_l0': 0.3797399303924418, 'activation_l1': 'leaky_relu', 'n_units_l1': 66, 'dropout_l1': 0.438855223289554, 'learning_rate': 4.00623502078751e-05}. Best is trial 53 with value: 0.8876923263072967.
[I 2025-03-20 22:01:58,891] Trial 69 finished with value: 0.8569230556488037 and parameters: {'activation_l0': 'leaky_relu', 'n_units_l0': 127, 'dropout_l0': 0.41416875541210774, 'activation_l1': 'leaky_relu', 'n_units_l1': 38, 'dropout_l1': 0.45944269118434133, 'learning_rate': 3.542869780272168e-05}. Best is trial 53 with value: 0.8876923263072967.
[I 2025-03-20 22:02:11,503] Trial 70 finished with value: 0.8904615223407744 and parameters: {'activation_l0': 'leaky_relu', 'n_units_l0': 88, 'dropout_l0': 0.33630347783559533, 'activation_l1': 'leaky_relu', 'n_units_l1': 56, 'dropout_l1': 0.43312734761328786, 'learning_rate': 2.6119474276204012e-05}. Best is trial 70 with value: 0.8904615223407744.
[I 2025-03-20 22:02:22,368] Trial 71 finished with value: 0.8573076963424682 and parameters: {'activation_l0': 'leaky_relu', 'n_units_l0': 87, 'dropout_l0': 0.36888676146825516, 'activation_l1': 'leaky_relu', 'n_units_l1': 44, 'dropout_l1': 0.43371204212707737, 'learning_rate': 2.5329982525490645e-05}. Best is trial 70 with value: 0.8904615223407744.
[I 2025-03-20 22:02:34,786] Trial 72 finished with value: 0.886692327260971 and parameters: {'activation_l0': 'leaky_relu', 'n_units_l0': 74, 'dropout_l0': 0.3356988508290335, 'activation_l1': 'leaky_relu', 'n_units_l1': 50, 'dropout_l1': 0.44926265546973654, 'learning_rate': 3.131484111720519e-05}. Best is trial 70 with value: 0.8904615223407744.
[I 2025-03-20 22:02:45,795] Trial 73 finished with value: 0.8780000150203704 and parameters: {'activation_l0': 'leaky_relu', 'n_units_l0': 56, 'dropout_l0': 0.35186727879808166, 'activation_l1': 'leaky_relu', 'n_units_l1': 55, 'dropout_l1': 0.4467725748571396, 'learning_rate': 3.069514312313005e-05}. Best is trial 70 with value: 0.8904615223407744.
[I 2025-03-20 22:02:54,662] Trial 74 finished with value: 0.8574615359306335 and parameters: {'activation_l0': 'leaky_relu', 'n_units_l0': 66, 'dropout_l0': 0.3306036294656249, 'activation_l1': 'leaky_relu', 'n_units_l1': 50, 'dropout_l1': 0.4282020732240276, 'learning_rate': 4.765349327647555e-05}. Best is trial 70 with value: 0.8904615223407744.
[I 2025-03-20 22:03:03,183] Trial 75 finished with value: 0.8308461427688598 and parameters: {'activation_l0': 'leaky_relu', 'n_units_l0': 75, 'dropout_l0': 0.3758571009236505, 'activation_l1': 'leaky_relu', 'n_units_l1': 56, 'dropout_l1': 0.4157903583553929, 'learning_rate': 3.563902406820319e-05}. Best is trial 70 with value: 0.8904615223407744.
[I 2025-03-20 22:03:14,029] Trial 76 finished with value: 0.8655384480953217 and parameters: {'activation_l0': 'elu', 'n_units_l0': 100, 'dropout_l0': 0.39467144509508434, 'activation_l1': 'elu', 'n_units_l1': 63, 'dropout_l1': 0.4036194420144014, 'learning_rate': 3.143930819288063e-05}. Best is trial 70 with value: 0.8904615223407744.
[I 2025-03-20 22:03:25,153] Trial 77 finished with value: 0.8780000150203704 and parameters: {'activation_l0': 'leaky_relu', 'n_units_l0': 62, 'dropout_l0': 0.357406669882165, 'activation_l1': 'leaky_relu', 'n_units_l1': 78, 'dropout_l1': 0.42529290639456996, 'learning_rate': 2.3354814846179152e-05}. Best is trial 70 with value: 0.8904615223407744.
[I 2025-03-20 22:03:35,348] Trial 78 finished with value: 0.8711922824382781 and parameters: {'activation_l0': 'leaky_relu', 'n_units_l0': 87, 'dropout_l0': 0.3402472859860372, 'activation_l1': 'leaky_relu', 'n_units_l1': 42, 'dropout_l1': 0.451709239493327, 'learning_rate': 5.8069729647353336e-05}. Best is trial 70 with value: 0.8904615223407744.
[I 2025-03-20 22:03:47,193] Trial 79 finished with value: 0.8662692487239837 and parameters: {'activation_l0': 'leaky_relu', 'n_units_l0': 72, 'dropout_l0': 0.4328279329048121, 'activation_l1': 'elu', 'n_units_l1': 69, 'dropout_l1': 0.4391066292320829, 'learning_rate': 2.702573466006184e-05}. Best is trial 70 with value: 0.8904615223407744.
[I 2025-03-20 22:03:52,502] Trial 80 pruned. Trial was pruned at epoch 10.
[I 2025-03-20 22:04:03,279] Trial 81 finished with value: 0.8315769016742706 and parameters: {'activation_l0': 'leaky_relu', 'n_units_l0': 108, 'dropout_l0': 0.2712238664848319, 'activation_l1': 'leaky_relu', 'n_units_l1': 26, 'dropout_l1': 0.4731967584197592, 'learning_rate': 2.0519030164929116e-05}. Best is trial 70 with value: 0.8904615223407744.
[I 2025-03-20 22:04:11,030] Trial 82 finished with value: 0.8459999859333038 and parameters: {'activation_l0': 'leaky_relu', 'n_units_l0': 114, 'dropout_l0': 0.21389928705070252, 'activation_l1': 'leaky_relu', 'n_units_l1': 30, 'dropout_l1': 0.4635168707848984, 'learning_rate': 2.239737404364019e-05}. Best is trial 70 with value: 0.8904615223407744.
[I 2025-03-20 22:04:23,970] Trial 83 finished with value: 0.8795384347438813 and parameters: {'activation_l0': 'leaky_relu', 'n_units_l0': 97, 'dropout_l0': 0.3360982602283805, 'activation_l1': 'leaky_relu', 'n_units_l1': 46, 'dropout_l1': 0.46721197024462935, 'learning_rate': 4.3649687725127926e-05}. Best is trial 70 with value: 0.8904615223407744.
[I 2025-03-20 22:04:43,951] Trial 84 finished with value: 0.8800769150257111 and parameters: {'activation_l0': 'leaky_relu', 'n_units_l0': 85, 'dropout_l0': 0.32620371935858034, 'activation_l1': 'leaky_relu', 'n_units_l1': 39, 'dropout_l1': 0.4852201553836869, 'learning_rate': 4.031887396741044e-05}. Best is trial 70 with value: 0.8904615223407744.
[I 2025-03-20 22:05:03,036] Trial 85 finished with value: 0.868230766057968 and parameters: {'activation_l0': 'leaky_relu', 'n_units_l0': 101, 'dropout_l0': 0.2443883040332827, 'activation_l1': 'leaky_relu', 'n_units_l1': 61, 'dropout_l1': 0.4928750168581528, 'learning_rate': 2.622654387214361e-05}. Best is trial 70 with value: 0.8904615223407744.
[I 2025-03-20 22:05:17,305] Trial 86 finished with value: 0.8609615325927733 and parameters: {'activation_l0': 'leaky_relu', 'n_units_l0': 70, 'dropout_l0': 0.36464940393295087, 'activation_l1': 'leaky_relu', 'n_units_l1': 87, 'dropout_l1': 0.4554567086001493, 'learning_rate': 3.2793633354402835e-05}. Best is trial 70 with value: 0.8904615223407744.
[I 2025-03-20 22:05:25,821] Trial 87 finished with value: 0.8497692227363587 and parameters: {'activation_l0': 'elu', 'n_units_l0': 117, 'dropout_l0': 0.2848166251876672, 'activation_l1': 'elu', 'n_units_l1': 52, 'dropout_l1': 0.21414433171538946, 'learning_rate': 2.446669956263328e-05}. Best is trial 70 with value: 0.8904615223407744.
[I 2025-03-20 22:05:38,563] Trial 88 finished with value: 0.8814230740070343 and parameters: {'activation_l0': 'leaky_relu', 'n_units_l0': 92, 'dropout_l0': 0.2971326739124445, 'activation_l1': 'leaky_relu', 'n_units_l1': 29, 'dropout_l1': 0.4450153645447752, 'learning_rate': 5.6049022077666706e-05}. Best is trial 70 with value: 0.8904615223407744.
[I 2025-03-20 22:05:44,040] Trial 89 pruned. Trial was pruned at epoch 10.
[I 2025-03-20 22:05:48,822] Trial 90 pruned. Trial was pruned at epoch 10.
[I 2025-03-20 22:05:54,272] Trial 91 finished with value: 0.816692316532135 and parameters: {'activation_l0': 'leaky_relu', 'n_units_l0': 92, 'dropout_l0': 0.30192168663628083, 'activation_l1': 'leaky_relu', 'n_units_l1': 40, 'dropout_l1': 0.44523506103360183, 'learning_rate': 6.202841456969531e-05}. Best is trial 70 with value: 0.8904615223407744.
[I 2025-03-20 22:06:04,632] Trial 92 finished with value: 0.8655384480953217 and parameters: {'activation_l0': 'leaky_relu', 'n_units_l0': 128, 'dropout_l0': 0.2986864071774786, 'activation_l1': 'leaky_relu', 'n_units_l1': 28, 'dropout_l1': 0.4435683269646795, 'learning_rate': 5.578638265108226e-05}. Best is trial 70 with value: 0.8904615223407744.
[I 2025-03-20 22:06:15,642] Trial 93 finished with value: 0.8839230895042418 and parameters: {'activation_l0': 'leaky_relu', 'n_units_l0': 79, 'dropout_l0': 0.288927996084865, 'activation_l1': 'leaky_relu', 'n_units_l1': 23, 'dropout_l1': 0.47661793867919433, 'learning_rate': 5.0765395241187834e-05}. Best is trial 70 with value: 0.8904615223407744.
[I 2025-03-20 22:06:20,087] Trial 94 pruned. Trial was pruned at epoch 14.
[I 2025-03-20 22:06:29,793] Trial 95 finished with value: 0.8666153669357299 and parameters: {'activation_l0': 'leaky_relu', 'n_units_l0': 74, 'dropout_l0': 0.2769571424377974, 'activation_l1': 'leaky_relu', 'n_units_l1': 26, 'dropout_l1': 0.46967500853530775, 'learning_rate': 5.183341437205284e-05}. Best is trial 70 with value: 0.8904615223407744.
[I 2025-03-20 22:06:39,407] Trial 96 finished with value: 0.8808845937252043 and parameters: {'activation_l0': 'leaky_relu', 'n_units_l0': 81, 'dropout_l0': 0.26682474466502637, 'activation_l1': 'elu', 'n_units_l1': 24, 'dropout_l1': 0.4976265444236718, 'learning_rate': 4.490439802477641e-05}. Best is trial 70 with value: 0.8904615223407744.
[I 2025-03-20 22:06:50,010] Trial 97 finished with value: 0.8579230546951293 and parameters: {'activation_l0': 'leaky_relu', 'n_units_l0': 42, 'dropout_l0': 0.33536841272938456, 'activation_l1': 'leaky_relu', 'n_units_l1': 36, 'dropout_l1': 0.48180878642735625, 'learning_rate': 4.146278784710388e-05}. Best is trial 70 with value: 0.8904615223407744.
[I 2025-03-20 22:06:57,755] Trial 98 finished with value: 0.8493077039718627 and parameters: {'activation_l0': 'leaky_relu', 'n_units_l0': 104, 'dropout_l0': 0.2505015589156773, 'activation_l1': 'leaky_relu', 'n_units_l1': 19, 'dropout_l1': 0.4535404797835376, 'learning_rate': 4.5731181580843806e-05}. Best is trial 70 with value: 0.8904615223407744.
[I 2025-03-20 22:07:07,742] Trial 99 finished with value: 0.8769230961799621 and parameters: {'activation_l0': 'leaky_relu', 'n_units_l0': 67, 'dropout_l0': 0.2927838739750811, 'activation_l1': 'leaky_relu', 'n_units_l1': 58, 'dropout_l1': 0.48977811087175865, 'learning_rate': 4.98962971627117e-05}. Best is trial 70 with value: 0.8904615223407744.