[I 2025-03-20 21:26:34,130] A new study created in memory with name: no-name-d7cb4de0-bd9a-4a8a-9640-0f71657b13f1
[I 2025-03-20 21:26:42,946] Trial 0 finished with value: 0.7518846154212951 and parameters: {'n_layers': 2, 'activation_l0': 'leaky_relu', 'n_units_l0': 10, 'dropout_l0': 0.33513330707594513, 'activation_l1': 'relu', 'n_units_l1': 5, 'dropout_l1': 0.3433796204381933, 'learning_rate': 4.392620186305584e-05}. Best is trial 0 with value: 0.7518846154212951.
[I 2025-03-20 21:26:49,288] Trial 1 finished with value: 0.7590384662151337 and parameters: {'n_layers': 3, 'activation_l0': 'leaky_relu', 'n_units_l0': 4, 'dropout_l0': 0.34770702475384585, 'activation_l1': 'leaky_relu', 'n_units_l1': 4, 'dropout_l1': 0.22734771723083663, 'activation_l2': 'relu', 'n_units_l2': 30, 'dropout_l2': 0.2612946921726789, 'learning_rate': 1.5643587421278956e-05}. Best is trial 1 with value: 0.7590384662151337.
[I 2025-03-20 21:26:55,420] Trial 2 finished with value: 0.5857307970523834 and parameters: {'n_layers': 4, 'activation_l0': 'elu', 'n_units_l0': 8, 'dropout_l0': 0.2586892594837451, 'activation_l1': 'relu', 'n_units_l1': 9, 'dropout_l1': 0.43282619667563116, 'activation_l2': 'elu', 'n_units_l2': 16, 'dropout_l2': 0.44710187827936143, 'activation_l3': 'relu', 'n_units_l3': 4, 'dropout_l3': 0.4002816200076548, 'learning_rate': 1.8799306043085745e-05}. Best is trial 1 with value: 0.7590384662151337.
[I 2025-03-20 21:27:03,045] Trial 3 finished with value: 0.7652307808399199 and parameters: {'n_layers': 3, 'activation_l0': 'selu', 'n_units_l0': 4, 'dropout_l0': 0.3807763739405199, 'activation_l1': 'selu', 'n_units_l1': 7, 'dropout_l1': 0.3775003266530976, 'activation_l2': 'leaky_relu', 'n_units_l2': 25, 'dropout_l2': 0.35707193485508, 'learning_rate': 3.285762406108334e-05}. Best is trial 3 with value: 0.7652307808399199.
[I 2025-03-20 21:27:11,020] Trial 4 finished with value: 0.8157307744026183 and parameters: {'n_layers': 3, 'activation_l0': 'leaky_relu', 'n_units_l0': 9, 'dropout_l0': 0.2184145283630616, 'activation_l1': 'relu', 'n_units_l1': 23, 'dropout_l1': 0.48546443442632176, 'activation_l2': 'selu', 'n_units_l2': 17, 'dropout_l2': 0.4847825609720101, 'learning_rate': 8.392983037546796e-05}. Best is trial 4 with value: 0.8157307744026183.
[I 2025-03-20 21:27:17,581] Trial 5 finished with value: 0.747038459777832 and parameters: {'n_layers': 4, 'activation_l0': 'leaky_relu', 'n_units_l0': 4, 'dropout_l0': 0.46563439802561507, 'activation_l1': 'selu', 'n_units_l1': 12, 'dropout_l1': 0.30666536137876, 'activation_l2': 'elu', 'n_units_l2': 14, 'dropout_l2': 0.2570824223261527, 'activation_l3': 'elu', 'n_units_l3': 4, 'dropout_l3': 0.4626675614427256, 'learning_rate': 1.2403944983365326e-05}. Best is trial 4 with value: 0.8157307744026183.
[I 2025-03-20 21:27:20,563] Trial 6 finished with value: 0.5799999833106995 and parameters: {'n_layers': 4, 'activation_l0': 'relu', 'n_units_l0': 9, 'dropout_l0': 0.40578766082969886, 'activation_l1': 'selu', 'n_units_l1': 5, 'dropout_l1': 0.2721329118241278, 'activation_l2': 'leaky_relu', 'n_units_l2': 29, 'dropout_l2': 0.455501173346394, 'activation_l3': 'selu', 'n_units_l3': 6, 'dropout_l3': 0.3076574152720915, 'learning_rate': 7.389858409451847e-05}. Best is trial 4 with value: 0.8157307744026183.
[I 2025-03-20 21:27:28,150] Trial 7 finished with value: 0.5754230678081512 and parameters: {'n_layers': 2, 'activation_l0': 'relu', 'n_units_l0': 4, 'dropout_l0': 0.32498918370065644, 'activation_l1': 'leaky_relu', 'n_units_l1': 10, 'dropout_l1': 0.37053197473257027, 'learning_rate': 8.884869061675337e-05}. Best is trial 4 with value: 0.8157307744026183.
[I 2025-03-20 21:27:35,886] Trial 8 finished with value: 0.818230789899826 and parameters: {'n_layers': 3, 'activation_l0': 'leaky_relu', 'n_units_l0': 4, 'dropout_l0': 0.2194868504407757, 'activation_l1': 'selu', 'n_units_l1': 6, 'dropout_l1': 0.3305845580976643, 'activation_l2': 'leaky_relu', 'n_units_l2': 33, 'dropout_l2': 0.22333912291298275, 'learning_rate': 3.90049550154869e-05}. Best is trial 8 with value: 0.818230789899826.
[I 2025-03-20 21:27:44,544] Trial 9 finished with value: 0.8453461468219756 and parameters: {'n_layers': 3, 'activation_l0': 'elu', 'n_units_l0': 9, 'dropout_l0': 0.312215231798885, 'activation_l1': 'selu', 'n_units_l1': 9, 'dropout_l1': 0.28604801764483434, 'activation_l2': 'selu', 'n_units_l2': 15, 'dropout_l2': 0.33805775417218986, 'learning_rate': 8.462987332115177e-05}. Best is trial 9 with value: 0.8453461468219756.
[I 2025-03-20 21:27:50,991] Trial 10 finished with value: 0.8610384702682494 and parameters: {'n_layers': 2, 'activation_l0': 'elu', 'n_units_l0': 6, 'dropout_l0': 0.28159021986674065, 'activation_l1': 'elu', 'n_units_l1': 17, 'dropout_l1': 0.24887332837118709, 'learning_rate': 5.605058174584307e-05}. Best is trial 10 with value: 0.8610384702682494.
[I 2025-03-20 21:27:57,206] Trial 11 finished with value: 0.8588076949119567 and parameters: {'n_layers': 2, 'activation_l0': 'elu', 'n_units_l0': 6, 'dropout_l0': 0.2840074919847056, 'activation_l1': 'elu', 'n_units_l1': 18, 'dropout_l1': 0.2019180329999117, 'learning_rate': 5.6923866652078386e-05}. Best is trial 10 with value: 0.8610384702682494.
[I 2025-03-20 21:28:05,027] Trial 12 finished with value: 0.840884631872177 and parameters: {'n_layers': 2, 'activation_l0': 'elu', 'n_units_l0': 6, 'dropout_l0': 0.2742499417725961, 'activation_l1': 'elu', 'n_units_l1': 19, 'dropout_l1': 0.22698879781398168, 'learning_rate': 5.675112750591475e-05}. Best is trial 10 with value: 0.8610384702682494.
[I 2025-03-20 21:28:12,857] Trial 13 finished with value: 0.8633846104145049 and parameters: {'n_layers': 2, 'activation_l0': 'elu', 'n_units_l0': 6, 'dropout_l0': 0.2868088815453722, 'activation_l1': 'elu', 'n_units_l1': 16, 'dropout_l1': 0.20505103389280682, 'learning_rate': 5.37398798756962e-05}. Best is trial 13 with value: 0.8633846104145049.
[I 2025-03-20 21:28:16,443] Trial 14 pruned. Trial was pruned at epoch 11.
[I 2025-03-20 21:28:23,898] Trial 15 finished with value: 0.8528077006340027 and parameters: {'n_layers': 2, 'activation_l0': 'selu', 'n_units_l0': 7, 'dropout_l0': 0.2961406060453071, 'activation_l1': 'elu', 'n_units_l1': 15, 'dropout_l1': 0.2008820220843245, 'learning_rate': 5.511296046542583e-05}. Best is trial 13 with value: 0.8633846104145049.
[I 2025-03-20 21:28:32,092] Trial 16 finished with value: 0.8180769324302672 and parameters: {'n_layers': 2, 'activation_l0': 'elu', 'n_units_l0': 5, 'dropout_l0': 0.3966575211072873, 'activation_l1': 'elu', 'n_units_l1': 20, 'dropout_l1': 0.26419874519657516, 'learning_rate': 2.6994311728133713e-05}. Best is trial 13 with value: 0.8633846104145049.
[I 2025-03-20 21:28:35,975] Trial 17 pruned. Trial was pruned at epoch 17.
[I 2025-03-20 21:28:43,323] Trial 18 finished with value: 0.8588846325874329 and parameters: {'n_layers': 2, 'activation_l0': 'elu', 'n_units_l0': 7, 'dropout_l0': 0.48437433617148806, 'activation_l1': 'elu', 'n_units_l1': 12, 'dropout_l1': 0.24852946948630994, 'learning_rate': 5.940214509546761e-05}. Best is trial 13 with value: 0.8633846104145049.
[I 2025-03-20 21:28:47,209] Trial 19 pruned. Trial was pruned at epoch 10.
[I 2025-03-20 21:28:49,648] Trial 20 pruned. Trial was pruned at epoch 10.
[I 2025-03-20 21:28:58,486] Trial 21 finished with value: 0.828307682275772 and parameters: {'n_layers': 2, 'activation_l0': 'elu', 'n_units_l0': 7, 'dropout_l0': 0.4500979981406983, 'activation_l1': 'elu', 'n_units_l1': 12, 'dropout_l1': 0.2393307093951564, 'learning_rate': 4.894937623621091e-05}. Best is trial 13 with value: 0.8633846104145049.
[I 2025-03-20 21:29:06,623] Trial 22 finished with value: 0.8284230649471283 and parameters: {'n_layers': 2, 'activation_l0': 'elu', 'n_units_l0': 7, 'dropout_l0': 0.4908893893279439, 'activation_l1': 'elu', 'n_units_l1': 11, 'dropout_l1': 0.25789438814250787, 'learning_rate': 6.551472156904449e-05}. Best is trial 13 with value: 0.8633846104145049.
[I 2025-03-20 21:29:15,461] Trial 23 finished with value: 0.8523461401462555 and parameters: {'n_layers': 2, 'activation_l0': 'elu', 'n_units_l0': 8, 'dropout_l0': 0.30456547212321894, 'activation_l1': 'elu', 'n_units_l1': 14, 'dropout_l1': 0.21902080153452505, 'learning_rate': 2.73692874487753e-05}. Best is trial 13 with value: 0.8633846104145049.
[I 2025-03-20 21:29:22,101] Trial 24 finished with value: 0.8227307677268982 and parameters: {'n_layers': 2, 'activation_l0': 'elu', 'n_units_l0': 5, 'dropout_l0': 0.2445230287746316, 'activation_l1': 'elu', 'n_units_l1': 8, 'dropout_l1': 0.2809652795549724, 'learning_rate': 9.493300653979604e-05}. Best is trial 13 with value: 0.8633846104145049.
[I 2025-03-20 21:29:25,600] Trial 25 pruned. Trial was pruned at epoch 10.
[I 2025-03-20 21:29:32,716] Trial 26 finished with value: 0.8413846075534821 and parameters: {'n_layers': 2, 'activation_l0': 'elu', 'n_units_l0': 6, 'dropout_l0': 0.49809944657466104, 'activation_l1': 'elu', 'n_units_l1': 13, 'dropout_l1': 0.21593183211758815, 'learning_rate': 6.233166331971535e-05}. Best is trial 13 with value: 0.8633846104145049.
[I 2025-03-20 21:29:41,191] Trial 27 finished with value: 0.8221153676509857 and parameters: {'n_layers': 3, 'activation_l0': 'elu', 'n_units_l0': 7, 'dropout_l0': 0.27031174804855224, 'activation_l1': 'elu', 'n_units_l1': 10, 'dropout_l1': 0.26058135140606664, 'activation_l2': 'relu', 'n_units_l2': 19, 'dropout_l2': 0.4138582007998304, 'learning_rate': 5.085636131044421e-05}. Best is trial 13 with value: 0.8633846104145049.
[I 2025-03-20 21:29:48,327] Trial 28 finished with value: 0.8404230713844298 and parameters: {'n_layers': 2, 'activation_l0': 'selu', 'n_units_l0': 6, 'dropout_l0': 0.4429559368913317, 'activation_l1': 'relu', 'n_units_l1': 20, 'dropout_l1': 0.23841438927233666, 'learning_rate': 7.321826435179421e-05}. Best is trial 13 with value: 0.8633846104145049.
[I 2025-03-20 21:29:50,513] Trial 29 pruned. Trial was pruned at epoch 10.
[I 2025-03-20 21:29:54,023] Trial 30 pruned. Trial was pruned at epoch 10.
[I 2025-03-20 21:30:02,315] Trial 31 finished with value: 0.8560384571552276 and parameters: {'n_layers': 2, 'activation_l0': 'elu', 'n_units_l0': 6, 'dropout_l0': 0.2860965490283624, 'activation_l1': 'elu', 'n_units_l1': 18, 'dropout_l1': 0.20192355173327126, 'learning_rate': 5.762140148636321e-05}. Best is trial 13 with value: 0.8633846104145049.
[I 2025-03-20 21:30:05,908] Trial 32 pruned. Trial was pruned at epoch 10.
[I 2025-03-20 21:30:14,743] Trial 33 finished with value: 0.8621153891086577 and parameters: {'n_layers': 2, 'activation_l0': 'elu', 'n_units_l0': 7, 'dropout_l0': 0.2521898418540035, 'activation_l1': 'elu', 'n_units_l1': 21, 'dropout_l1': 0.2188742247059416, 'learning_rate': 7.651232142910777e-05}. Best is trial 13 with value: 0.8633846104145049.
[I 2025-03-20 21:30:21,451] Trial 34 finished with value: 0.8573846161365508 and parameters: {'n_layers': 3, 'activation_l0': 'elu', 'n_units_l0': 7, 'dropout_l0': 0.24944443415729814, 'activation_l1': 'elu', 'n_units_l1': 21, 'dropout_l1': 0.23229790031844672, 'activation_l2': 'selu', 'n_units_l2': 24, 'dropout_l2': 0.20617869722031848, 'learning_rate': 7.916396671225526e-05}. Best is trial 13 with value: 0.8633846104145049.
[I 2025-03-20 21:30:28,087] Trial 35 finished with value: 0.8514615416526794 and parameters: {'n_layers': 2, 'activation_l0': 'leaky_relu', 'n_units_l0': 8, 'dropout_l0': 0.22515571229592798, 'activation_l1': 'elu', 'n_units_l1': 23, 'dropout_l1': 0.29221896982713036, 'learning_rate': 6.729601347330902e-05}. Best is trial 13 with value: 0.8633846104145049.
[I 2025-03-20 21:30:31,484] Trial 36 pruned. Trial was pruned at epoch 10.
[I 2025-03-20 21:30:41,063] Trial 37 finished with value: 0.7417307436466216 and parameters: {'n_layers': 4, 'activation_l0': 'selu', 'n_units_l0': 10, 'dropout_l0': 0.2613379157420377, 'activation_l1': 'leaky_relu', 'n_units_l1': 4, 'dropout_l1': 0.26644568157576154, 'activation_l2': 'elu', 'n_units_l2': 18, 'dropout_l2': 0.2969389377569313, 'activation_l3': 'leaky_relu', 'n_units_l3': 8, 'dropout_l3': 0.20584179598567368, 'learning_rate': 1.0047971656962588e-05}. Best is trial 13 with value: 0.8633846104145049.
[I 2025-03-20 21:30:44,571] Trial 38 pruned. Trial was pruned at epoch 10.
[I 2025-03-20 21:30:48,163] Trial 39 pruned. Trial was pruned at epoch 10.
[I 2025-03-20 21:30:53,846] Trial 40 finished with value: 0.8154615342617035 and parameters: {'n_layers': 2, 'activation_l0': 'elu', 'n_units_l0': 8, 'dropout_l0': 0.30170052437056644, 'activation_l1': 'relu', 'n_units_l1': 8, 'dropout_l1': 0.2762111242284845, 'learning_rate': 3.846335361441233e-05}. Best is trial 13 with value: 0.8633846104145049.
[I 2025-03-20 21:31:02,271] Trial 41 finished with value: 0.8563846170902252 and parameters: {'n_layers': 2, 'activation_l0': 'elu', 'n_units_l0': 6, 'dropout_l0': 0.278931568599652, 'activation_l1': 'elu', 'n_units_l1': 18, 'dropout_l1': 0.2160235659358772, 'learning_rate': 6.21468422076652e-05}. Best is trial 13 with value: 0.8633846104145049.
[I 2025-03-20 21:31:11,116] Trial 42 finished with value: 0.8495769023895263 and parameters: {'n_layers': 2, 'activation_l0': 'elu', 'n_units_l0': 7, 'dropout_l0': 0.2576626057288625, 'activation_l1': 'elu', 'n_units_l1': 16, 'dropout_l1': 0.24791698384389937, 'learning_rate': 5.500306600103223e-05}. Best is trial 13 with value: 0.8633846104145049.
[I 2025-03-20 21:31:19,560] Trial 43 finished with value: 0.8392692327499389 and parameters: {'n_layers': 2, 'activation_l0': 'elu', 'n_units_l0': 6, 'dropout_l0': 0.2046390610137897, 'activation_l1': 'elu', 'n_units_l1': 21, 'dropout_l1': 0.2166110717107729, 'learning_rate': 1.5659528533241465e-05}. Best is trial 13 with value: 0.8633846104145049.
[I 2025-03-20 21:31:26,876] Trial 44 finished with value: 0.8677692234516143 and parameters: {'n_layers': 2, 'activation_l0': 'elu', 'n_units_l0': 5, 'dropout_l0': 0.2949469231040264, 'activation_l1': 'elu', 'n_units_l1': 14, 'dropout_l1': 0.20993560869477101, 'learning_rate': 7.100635133809283e-05}. Best is trial 44 with value: 0.8677692234516143.
[I 2025-03-20 21:31:36,890] Trial 45 finished with value: 0.8334230780601501 and parameters: {'n_layers': 2, 'activation_l0': 'leaky_relu', 'n_units_l0': 5, 'dropout_l0': 0.3214180380675002, 'activation_l1': 'selu', 'n_units_l1': 13, 'dropout_l1': 0.23071557066819276, 'learning_rate': 8.584514432156168e-05}. Best is trial 44 with value: 0.8677692234516143.
[I 2025-03-20 21:31:47,969] Trial 46 finished with value: 0.8561153769493102 and parameters: {'n_layers': 3, 'activation_l0': 'elu', 'n_units_l0': 9, 'dropout_l0': 0.29503041398216623, 'activation_l1': 'elu', 'n_units_l1': 14, 'dropout_l1': 0.24772031908356293, 'activation_l2': 'relu', 'n_units_l2': 34, 'dropout_l2': 0.4096042970631142, 'learning_rate': 7.301269509109469e-05}. Best is trial 44 with value: 0.8677692234516143.
[I 2025-03-20 21:31:53,831] Trial 47 pruned. Trial was pruned at epoch 31.
[I 2025-03-20 21:31:59,519] Trial 48 finished with value: 0.7742692112922669 and parameters: {'n_layers': 2, 'activation_l0': 'elu', 'n_units_l0': 5, 'dropout_l0': 0.2693120526972548, 'activation_l1': 'leaky_relu', 'n_units_l1': 15, 'dropout_l1': 0.3430098051632523, 'learning_rate': 4.2998509224647764e-05}. Best is trial 44 with value: 0.8677692234516143.
[I 2025-03-20 21:32:03,062] Trial 49 pruned. Trial was pruned at epoch 10.
[I 2025-03-20 21:32:07,810] Trial 50 pruned. Trial was pruned at epoch 19.
[I 2025-03-20 21:32:15,140] Trial 51 finished with value: 0.8393461525440216 and parameters: {'n_layers': 2, 'activation_l0': 'elu', 'n_units_l0': 6, 'dropout_l0': 0.2902850893727769, 'activation_l1': 'elu', 'n_units_l1': 19, 'dropout_l1': 0.20699992543452397, 'learning_rate': 5.961818464005421e-05}. Best is trial 44 with value: 0.8677692234516143.
[I 2025-03-20 21:32:22,687] Trial 52 finished with value: 0.849653822183609 and parameters: {'n_layers': 2, 'activation_l0': 'elu', 'n_units_l0': 6, 'dropout_l0': 0.2589450685906234, 'activation_l1': 'elu', 'n_units_l1': 18, 'dropout_l1': 0.22883985824617697, 'learning_rate': 6.993532857625091e-05}. Best is trial 44 with value: 0.8677692234516143.
[I 2025-03-20 21:32:29,515] Trial 53 finished with value: 0.8623076915740966 and parameters: {'n_layers': 2, 'activation_l0': 'elu', 'n_units_l0': 7, 'dropout_l0': 0.2764738298598529, 'activation_l1': 'elu', 'n_units_l1': 23, 'dropout_l1': 0.2125316685398839, 'learning_rate': 5.3794787337375743e-05}. Best is trial 44 with value: 0.8677692234516143.
[I 2025-03-20 21:32:37,608] Trial 54 finished with value: 0.8633846104145049 and parameters: {'n_layers': 2, 'activation_l0': 'elu', 'n_units_l0': 7, 'dropout_l0': 0.27147398011829027, 'activation_l1': 'elu', 'n_units_l1': 22, 'dropout_l1': 0.2358275388610554, 'learning_rate': 4.6311321647570216e-05}. Best is trial 44 with value: 0.8677692234516143.
[I 2025-03-20 21:32:47,391] Trial 55 finished with value: 0.8701923012733459 and parameters: {'n_layers': 2, 'activation_l0': 'elu', 'n_units_l0': 7, 'dropout_l0': 0.22925717605496512, 'activation_l1': 'elu', 'n_units_l1': 22, 'dropout_l1': 0.21296346462715804, 'learning_rate': 4.621347430678944e-05}. Best is trial 55 with value: 0.8701923012733459.
[I 2025-03-20 21:32:51,855] Trial 56 pruned. Trial was pruned at epoch 10.
[I 2025-03-20 21:33:01,610] Trial 57 finished with value: 0.849500024318695 and parameters: {'n_layers': 2, 'activation_l0': 'elu', 'n_units_l0': 8, 'dropout_l0': 0.2111249417218095, 'activation_l1': 'elu', 'n_units_l1': 21, 'dropout_l1': 0.2350346736525898, 'learning_rate': 4.508610191303752e-05}. Best is trial 55 with value: 0.8701923012733459.
[I 2025-03-20 21:33:11,218] Trial 58 finished with value: 0.8602307915687561 and parameters: {'n_layers': 2, 'activation_l0': 'elu', 'n_units_l0': 7, 'dropout_l0': 0.21589131486115867, 'activation_l1': 'elu', 'n_units_l1': 22, 'dropout_l1': 0.22828726583515346, 'learning_rate': 5.359488232993095e-05}. Best is trial 55 with value: 0.8701923012733459.
[I 2025-03-20 21:33:18,686] Trial 59 finished with value: 0.850884598493576 and parameters: {'n_layers': 2, 'activation_l0': 'leaky_relu', 'n_units_l0': 4, 'dropout_l0': 0.25249477317041175, 'activation_l1': 'elu', 'n_units_l1': 20, 'dropout_l1': 0.2088749410086437, 'learning_rate': 4.793236761967745e-05}. Best is trial 55 with value: 0.8701923012733459.
[I 2025-03-20 21:33:26,726] Trial 60 finished with value: 0.8433846294879913 and parameters: {'n_layers': 2, 'activation_l0': 'elu', 'n_units_l0': 7, 'dropout_l0': 0.26910918561459524, 'activation_l1': 'elu', 'n_units_l1': 22, 'dropout_l1': 0.22268255470310314, 'learning_rate': 4.18470359547268e-05}. Best is trial 55 with value: 0.8701923012733459.
[I 2025-03-20 21:33:33,866] Trial 61 finished with value: 0.8696538627147674 and parameters: {'n_layers': 2, 'activation_l0': 'elu', 'n_units_l0': 7, 'dropout_l0': 0.27587376556606125, 'activation_l1': 'elu', 'n_units_l1': 20, 'dropout_l1': 0.24025835095113837, 'learning_rate': 6.361868235132616e-05}. Best is trial 55 with value: 0.8701923012733459.
[I 2025-03-20 21:33:44,826] Trial 62 finished with value: 0.8561153769493102 and parameters: {'n_layers': 2, 'activation_l0': 'elu', 'n_units_l0': 7, 'dropout_l0': 0.24017511963095295, 'activation_l1': 'elu', 'n_units_l1': 20, 'dropout_l1': 0.23926294293627098, 'learning_rate': 6.363758878881814e-05}. Best is trial 55 with value: 0.8701923012733459.
[I 2025-03-20 21:33:55,231] Trial 63 finished with value: 0.8435769081115723 and parameters: {'n_layers': 2, 'activation_l0': 'elu', 'n_units_l0': 8, 'dropout_l0': 0.2755447694628328, 'activation_l1': 'elu', 'n_units_l1': 23, 'dropout_l1': 0.210430605346945, 'learning_rate': 3.724785510862913e-05}. Best is trial 55 with value: 0.8701923012733459.
[I 2025-03-20 21:34:05,789] Trial 64 finished with value: 0.849653822183609 and parameters: {'n_layers': 2, 'activation_l0': 'elu', 'n_units_l0': 9, 'dropout_l0': 0.2600618494269604, 'activation_l1': 'elu', 'n_units_l1': 6, 'dropout_l1': 0.2014200488876814, 'learning_rate': 9.086020203256703e-05}. Best is trial 55 with value: 0.8701923012733459.
[I 2025-03-20 21:34:12,005] Trial 65 finished with value: 0.8387307941913604 and parameters: {'n_layers': 2, 'activation_l0': 'elu', 'n_units_l0': 7, 'dropout_l0': 0.2969337196404285, 'activation_l1': 'elu', 'n_units_l1': 19, 'dropout_l1': 0.2562449189449772, 'learning_rate': 4.7218691133318776e-05}. Best is trial 55 with value: 0.8701923012733459.
[I 2025-03-20 21:34:20,328] Trial 66 finished with value: 0.8625769317150116 and parameters: {'n_layers': 2, 'activation_l0': 'elu', 'n_units_l0': 7, 'dropout_l0': 0.31301121557675843, 'activation_l1': 'leaky_relu', 'n_units_l1': 21, 'dropout_l1': 0.2243029009179756, 'learning_rate': 7.082967543982946e-05}. Best is trial 55 with value: 0.8701923012733459.
[I 2025-03-20 21:34:23,948] Trial 67 pruned. Trial was pruned at epoch 10.
[I 2025-03-20 21:34:32,343] Trial 68 finished with value: 0.8608461499214171 and parameters: {'n_layers': 2, 'activation_l0': 'elu', 'n_units_l0': 7, 'dropout_l0': 0.3254179182655509, 'activation_l1': 'leaky_relu', 'n_units_l1': 16, 'dropout_l1': 0.2414391177683225, 'learning_rate': 5.8011583011720956e-05}. Best is trial 55 with value: 0.8701923012733459.
[I 2025-03-20 21:34:41,140] Trial 69 finished with value: 0.845269227027893 and parameters: {'n_layers': 2, 'activation_l0': 'selu', 'n_units_l0': 7, 'dropout_l0': 0.30966728074234207, 'activation_l1': 'leaky_relu', 'n_units_l1': 19, 'dropout_l1': 0.22610128589358255, 'learning_rate': 6.885026538075088e-05}. Best is trial 55 with value: 0.8701923012733459.
[I 2025-03-20 21:34:44,980] Trial 70 pruned. Trial was pruned at epoch 19.
