[I 2025-03-20 21:34:53,489] Trial 71 finished with value: 0.8641153693199157 and parameters: {'n_layers': 2, 'activation_l0': 'elu', 'n_units_l0': 7, 'dropout_l0': 0.2876970450503843, 'activation_l1': 'elu', 'n_units_l1': 21, 'dropout_l1': 0.22079769151675926, 'learning_rate': 7.352673521749359e-05}. Best is trial 55 with value: 0.8701923012733459.
[I 2025-03-20 21:34:57,250] Trial 72 pruned. Trial was pruned at epoch 10.
[I 2025-03-20 21:35:08,210] Trial 73 finished with value: 0.8573846161365508 and parameters: {'n_layers': 2, 'activation_l0': 'elu', 'n_units_l0': 7, 'dropout_l0': 0.30270209720592023, 'activation_l1': 'elu', 'n_units_l1': 22, 'dropout_l1': 0.20012434060063644, 'learning_rate': 6.823358818488393e-05}. Best is trial 55 with value: 0.8701923012733459.
[I 2025-03-20 21:35:14,473] Trial 74 pruned. Trial was pruned at epoch 19.
[I 2025-03-20 21:35:22,878] Trial 75 finished with value: 0.8614230930805206 and parameters: {'n_layers': 2, 'activation_l0': 'elu', 'n_units_l0': 8, 'dropout_l0': 0.267141798404385, 'activation_l1': 'elu', 'n_units_l1': 23, 'dropout_l1': 0.2531477277802582, 'learning_rate': 6.01888270879368e-05}. Best is trial 55 with value: 0.8701923012733459.
[I 2025-03-20 21:35:31,590] Trial 76 finished with value: 0.8432307720184327 and parameters: {'n_layers': 2, 'activation_l0': 'elu', 'n_units_l0': 7, 'dropout_l0': 0.29251151489012345, 'activation_l1': 'selu', 'n_units_l1': 17, 'dropout_l1': 0.26474152989160304, 'learning_rate': 5.3241854983054204e-05}. Best is trial 55 with value: 0.8701923012733459.
[I 2025-03-20 21:35:35,562] Trial 77 pruned. Trial was pruned at epoch 10.
[I 2025-03-20 21:35:44,018] Trial 78 finished with value: 0.8688461422920226 and parameters: {'n_layers': 2, 'activation_l0': 'elu', 'n_units_l0': 7, 'dropout_l0': 0.28113380216237355, 'activation_l1': 'elu', 'n_units_l1': 20, 'dropout_l1': 0.21822038298110066, 'learning_rate': 6.591095413862672e-05}. Best is trial 55 with value: 0.8701923012733459.
[I 2025-03-20 21:35:50,138] Trial 79 finished with value: 0.871807700395584 and parameters: {'n_layers': 2, 'activation_l0': 'leaky_relu', 'n_units_l0': 6, 'dropout_l0': 0.3039562395002162, 'activation_l1': 'elu', 'n_units_l1': 17, 'dropout_l1': 0.22161098852439814, 'learning_rate': 7.724692835811637e-05}. Best is trial 79 with value: 0.871807700395584.
[I 2025-03-20 21:35:57,539] Trial 80 finished with value: 0.8365769147872923 and parameters: {'n_layers': 2, 'activation_l0': 'leaky_relu', 'n_units_l0': 6, 'dropout_l0': 0.2840496655163972, 'activation_l1': 'elu', 'n_units_l1': 17, 'dropout_l1': 0.28218499905693484, 'learning_rate': 7.559778361423436e-05}. Best is trial 79 with value: 0.871807700395584.
[I 2025-03-20 21:36:04,794] Trial 81 finished with value: 0.8534230589866638 and parameters: {'n_layers': 2, 'activation_l0': 'leaky_relu', 'n_units_l0': 6, 'dropout_l0': 0.30001001239421693, 'activation_l1': 'elu', 'n_units_l1': 20, 'dropout_l1': 0.2336189143144496, 'learning_rate': 6.456616387324128e-05}. Best is trial 79 with value: 0.871807700395584.
[I 2025-03-20 21:36:11,906] Trial 82 finished with value: 0.8643461465835571 and parameters: {'n_layers': 2, 'activation_l0': 'leaky_relu', 'n_units_l0': 7, 'dropout_l0': 0.3127726597228671, 'activation_l1': 'elu', 'n_units_l1': 19, 'dropout_l1': 0.22224603033835985, 'learning_rate': 7.683134568345366e-05}. Best is trial 79 with value: 0.871807700395584.
[I 2025-03-20 21:36:17,602] Trial 83 finished with value: 0.853884619474411 and parameters: {'n_layers': 2, 'activation_l0': 'leaky_relu', 'n_units_l0': 6, 'dropout_l0': 0.29040754035835525, 'activation_l1': 'elu', 'n_units_l1': 19, 'dropout_l1': 0.219392022069759, 'learning_rate': 7.988177627440323e-05}. Best is trial 79 with value: 0.871807700395584.
[I 2025-03-20 21:36:25,415] Trial 84 finished with value: 0.8505769431591033 and parameters: {'n_layers': 2, 'activation_l0': 'leaky_relu', 'n_units_l0': 7, 'dropout_l0': 0.3057970982608438, 'activation_l1': 'elu', 'n_units_l1': 16, 'dropout_l1': 0.20819000821252562, 'learning_rate': 8.810260190854421e-05}. Best is trial 79 with value: 0.871807700395584.
[I 2025-03-20 21:36:30,984] Trial 85 finished with value: 0.804153823852539 and parameters: {'n_layers': 2, 'activation_l0': 'leaky_relu', 'n_units_l0': 8, 'dropout_l0': 0.33076141791151364, 'activation_l1': 'elu', 'n_units_l1': 18, 'dropout_l1': 0.4995716118874949, 'learning_rate': 6.557899442745405e-05}. Best is trial 79 with value: 0.871807700395584.
[I 2025-03-20 21:36:37,129] Trial 86 finished with value: 0.8374615550041198 and parameters: {'n_layers': 2, 'activation_l0': 'leaky_relu', 'n_units_l0': 7, 'dropout_l0': 0.2665032511466607, 'activation_l1': 'elu', 'n_units_l1': 18, 'dropout_l1': 0.21491138636608284, 'learning_rate': 7.651665520860846e-05}. Best is trial 79 with value: 0.871807700395584.
[I 2025-03-20 21:36:44,672] Trial 87 finished with value: 0.8157692372798919 and parameters: {'n_layers': 2, 'activation_l0': 'leaky_relu', 'n_units_l0': 5, 'dropout_l0': 0.33817500616895846, 'activation_l1': 'elu', 'n_units_l1': 20, 'dropout_l1': 0.24382481221256302, 'learning_rate': 5.762106195767118e-05}. Best is trial 79 with value: 0.871807700395584.
[I 2025-03-20 21:36:46,892] Trial 88 pruned. Trial was pruned at epoch 10.
[I 2025-03-20 21:36:50,876] Trial 89 pruned. Trial was pruned at epoch 10.
[I 2025-03-20 21:36:58,825] Trial 90 finished with value: 0.828307682275772 and parameters: {'n_layers': 2, 'activation_l0': 'selu', 'n_units_l0': 4, 'dropout_l0': 0.348963211887927, 'activation_l1': 'elu', 'n_units_l1': 15, 'dropout_l1': 0.2041443807798018, 'learning_rate': 6.0732026062700243e-05}. Best is trial 79 with value: 0.871807700395584.
[I 2025-03-20 21:37:09,201] Trial 91 finished with value: 0.8693076848983765 and parameters: {'n_layers': 2, 'activation_l0': 'elu', 'n_units_l0': 7, 'dropout_l0': 0.31402014297440367, 'activation_l1': 'elu', 'n_units_l1': 21, 'dropout_l1': 0.22143199967180854, 'learning_rate': 6.883653129531395e-05}. Best is trial 79 with value: 0.871807700395584.
[I 2025-03-20 21:37:19,398] Trial 92 finished with value: 0.8737692177295684 and parameters: {'n_layers': 2, 'activation_l0': 'elu', 'n_units_l0': 7, 'dropout_l0': 0.2927082881799635, 'activation_l1': 'elu', 'n_units_l1': 21, 'dropout_l1': 0.23198153702788293, 'learning_rate': 8.412748886356889e-05}. Best is trial 92 with value: 0.8737692177295684.
[I 2025-03-20 21:37:30,475] Trial 93 finished with value: 0.856846135854721 and parameters: {'n_layers': 2, 'activation_l0': 'elu', 'n_units_l0': 7, 'dropout_l0': 0.2987758029015164, 'activation_l1': 'elu', 'n_units_l1': 19, 'dropout_l1': 0.2156491537171103, 'learning_rate': 9.359365409521387e-05}. Best is trial 92 with value: 0.8737692177295684.
[I 2025-03-20 21:37:36,974] Trial 94 finished with value: 0.8373846352100371 and parameters: {'n_layers': 2, 'activation_l0': 'leaky_relu', 'n_units_l0': 7, 'dropout_l0': 0.31038066788429897, 'activation_l1': 'elu', 'n_units_l1': 21, 'dropout_l1': 0.22977960009167225, 'learning_rate': 8.370574956439749e-05}. Best is trial 92 with value: 0.8737692177295684.
[I 2025-03-20 21:37:44,649] Trial 95 finished with value: 0.8617692112922668 and parameters: {'n_layers': 2, 'activation_l0': 'elu', 'n_units_l0': 6, 'dropout_l0': 0.2895326816212116, 'activation_l1': 'elu', 'n_units_l1': 20, 'dropout_l1': 0.21991931132981385, 'learning_rate': 7.39600117967991e-05}. Best is trial 92 with value: 0.8737692177295684.
[I 2025-03-20 21:37:51,487] Trial 96 finished with value: 0.8555768966674804 and parameters: {'n_layers': 2, 'activation_l0': 'elu', 'n_units_l0': 7, 'dropout_l0': 0.3640299576824796, 'activation_l1': 'elu', 'n_units_l1': 16, 'dropout_l1': 0.32348943434057, 'learning_rate': 7.882620027632126e-05}. Best is trial 92 with value: 0.8737692177295684.
[I 2025-03-20 21:37:59,616] Trial 97 finished with value: 0.8751153767108917 and parameters: {'n_layers': 2, 'activation_l0': 'elu', 'n_units_l0': 7, 'dropout_l0': 0.28028039733002263, 'activation_l1': 'elu', 'n_units_l1': 19, 'dropout_l1': 0.20669032313428332, 'learning_rate': 6.689344561093338e-05}. Best is trial 97 with value: 0.8751153767108917.
[I 2025-03-20 21:38:08,096] Trial 98 finished with value: 0.8456538498401642 and parameters: {'n_layers': 2, 'activation_l0': 'elu', 'n_units_l0': 7, 'dropout_l0': 0.28087034240527115, 'activation_l1': 'selu', 'n_units_l1': 19, 'dropout_l1': 0.20557787130865132, 'learning_rate': 6.650269036778285e-05}. Best is trial 97 with value: 0.8751153767108917.
[I 2025-03-20 21:38:16,727] Trial 99 finished with value: 0.8696538627147674 and parameters: {'n_layers': 3, 'activation_l0': 'leaky_relu', 'n_units_l0': 8, 'dropout_l0': 0.32019398206204963, 'activation_l1': 'elu', 'n_units_l1': 21, 'dropout_l1': 0.23713695976168309, 'activation_l2': 'elu', 'n_units_l2': 20, 'dropout_l2': 0.2790196260766975, 'learning_rate': 8.641723736639654e-05}. Best is trial 97 with value: 0.8751153767108917.