[I 2025-03-20 16:30:05,664] Trial 154 finished with value: 0.8999999761581421 and parameters: {'n_layers': 3, 'activation_l0': 'leaky_relu', 'n_units_l0': 47, 'dropout_l0': 0.3701256457304529, 'activation_l1': 'tanh', 'n_units_l1': 13, 'dropout_l1': 0.4679062270663418, 'activation_l2': 'selu', 'n_units_l2': 14, 'dropout_l2': 0.42074138345888046}. Best is trial 29 with value: 0.9599999785423279.
[I 2025-03-20 16:30:17,243] Trial 155 finished with value: 0.8799999952316284 and parameters: {'n_layers': 2, 'activation_l0': 'leaky_relu', 'n_units_l0': 37, 'dropout_l0': 0.44698269552869246, 'activation_l1': 'elu', 'n_units_l1': 41, 'dropout_l1': 0.39631667815356153}. Best is trial 29 with value: 0.9599999785423279.
[I 2025-03-20 16:30:33,776] Trial 156 finished with value: 0.9399999976158142 and parameters: {'n_layers': 3, 'activation_l0': 'selu', 'n_units_l0': 32, 'dropout_l0': 0.3496470732127753, 'activation_l1': 'tanh', 'n_units_l1': 6, 'dropout_l1': 0.3486039964210039, 'activation_l2': 'elu', 'n_units_l2': 20, 'dropout_l2': 0.43783557790824146}. Best is trial 29 with value: 0.9599999785423279.
[I 2025-03-20 16:30:48,059] Trial 157 finished with value: 0.8600000143051147 and parameters: {'n_layers': 3, 'activation_l0': 'selu', 'n_units_l0': 31, 'dropout_l0': 0.2736608959028871, 'activation_l1': 'selu', 'n_units_l1': 5, 'dropout_l1': 0.34868823680820926, 'activation_l2': 'elu', 'n_units_l2': 20, 'dropout_l2': 0.4449161391954611}. Best is trial 29 with value: 0.9599999785423279.
[I 2025-03-20 16:31:01,892] Trial 158 finished with value: 0.8600000143051147 and parameters: {'n_layers': 3, 'activation_l0': 'selu', 'n_units_l0': 35, 'dropout_l0': 0.3959932144854387, 'activation_l1': 'tanh', 'n_units_l1': 7, 'dropout_l1': 0.35773480355770637, 'activation_l2': 'elu', 'n_units_l2': 17, 'dropout_l2': 0.4650236480737545}. Best is trial 29 with value: 0.9599999785423279.
[I 2025-03-20 16:31:10,419] Trial 159 finished with value: 0.7799999713897705 and parameters: {'n_layers': 3, 'activation_l0': 'selu', 'n_units_l0': 23, 'dropout_l0': 0.46131559533640637, 'activation_l1': 'relu', 'n_units_l1': 8, 'dropout_l1': 0.3311215746420743, 'activation_l2': 'elu', 'n_units_l2': 21, 'dropout_l2': 0.31314812334221326}. Best is trial 29 with value: 0.9599999785423279.
[I 2025-03-20 16:31:22,363] Trial 160 finished with value: 0.8799999952316284 and parameters: {'n_layers': 3, 'activation_l0': 'selu', 'n_units_l0': 27, 'dropout_l0': 0.34563374257890034, 'activation_l1': 'elu', 'n_units_l1': 6, 'dropout_l1': 0.3700526196127015, 'activation_l2': 'elu', 'n_units_l2': 29, 'dropout_l2': 0.42997464358645265}. Best is trial 29 with value: 0.9599999785423279.
[I 2025-03-20 16:31:36,006] Trial 161 finished with value: 0.8399999737739563 and parameters: {'n_layers': 3, 'activation_l0': 'tanh', 'n_units_l0': 29, 'dropout_l0': 0.23578033660849493, 'activation_l1': 'tanh', 'n_units_l1': 54, 'dropout_l1': 0.4912369317044251, 'activation_l2': 'tanh', 'n_units_l2': 16, 'dropout_l2': 0.4539677627745198}. Best is trial 29 with value: 0.9599999785423279.
[I 2025-03-20 16:31:47,557] Trial 162 finished with value: 0.8799999952316284 and parameters: {'n_layers': 3, 'activation_l0': 'selu', 'n_units_l0': 33, 'dropout_l0': 0.31349437004378294, 'activation_l1': 'tanh', 'n_units_l1': 65, 'dropout_l1': 0.40474515323419796, 'activation_l2': 'elu', 'n_units_l2': 19, 'dropout_l2': 0.3294845874243946}. Best is trial 29 with value: 0.9599999785423279.
[I 2025-03-20 16:31:59,252] Trial 163 finished with value: 0.8199999928474426 and parameters: {'n_layers': 2, 'activation_l0': 'leaky_relu', 'n_units_l0': 4, 'dropout_l0': 0.4215940859426102, 'activation_l1': 'tanh', 'n_units_l1': 14, 'dropout_l1': 0.45481870570250427}. Best is trial 29 with value: 0.9599999785423279.
[I 2025-03-20 16:32:08,844] Trial 164 finished with value: 0.8600000143051147 and parameters: {'n_layers': 3, 'activation_l0': 'tanh', 'n_units_l0': 52, 'dropout_l0': 0.38805118416300316, 'activation_l1': 'tanh', 'n_units_l1': 16, 'dropout_l1': 0.42886947141958726, 'activation_l2': 'elu', 'n_units_l2': 4, 'dropout_l2': 0.39925408832883963}. Best is trial 29 with value: 0.9599999785423279.
[I 2025-03-20 16:32:23,208] Trial 165 finished with value: 0.8999999761581421 and parameters: {'n_layers': 3, 'activation_l0': 'leaky_relu', 'n_units_l0': 9, 'dropout_l0': 0.48287405674989897, 'activation_l1': 'selu', 'n_units_l1': 77, 'dropout_l1': 0.4745968142338132, 'activation_l2': 'relu', 'n_units_l2': 7, 'dropout_l2': 0.4369058075261641}. Best is trial 29 with value: 0.9599999785423279.
[I 2025-03-20 16:32:35,760] Trial 166 finished with value: 0.9200000166893005 and parameters: {'n_layers': 2, 'activation_l0': 'tanh', 'n_units_l0': 5, 'dropout_l0': 0.45327551962215323, 'activation_l1': 'tanh', 'n_units_l1': 5, 'dropout_l1': 0.3636047175913631}. Best is trial 29 with value: 0.9599999785423279.
[I 2025-03-20 16:32:48,919] Trial 167 finished with value: 0.9399999976158142 and parameters: {'n_layers': 3, 'activation_l0': 'leaky_relu', 'n_units_l0': 6, 'dropout_l0': 0.28228600751105143, 'activation_l1': 'selu', 'n_units_l1': 7, 'dropout_l1': 0.42215474547559384, 'activation_l2': 'tanh', 'n_units_l2': 23, 'dropout_l2': 0.3409383581373352}. Best is trial 29 with value: 0.9599999785423279.
[I 2025-03-20 16:33:06,918] Trial 168 finished with value: 0.8999999761581421 and parameters: {'n_layers': 3, 'activation_l0': 'elu', 'n_units_l0': 39, 'dropout_l0': 0.2844875188874401, 'activation_l1': 'selu', 'n_units_l1': 7, 'dropout_l1': 0.4377186275884944, 'activation_l2': 'tanh', 'n_units_l2': 27, 'dropout_l2': 0.34879860545629104}. Best is trial 29 with value: 0.9599999785423279.
[I 2025-03-20 16:33:16,838] Trial 169 pruned. Trial was pruned at epoch 14.
[I 2025-03-20 16:33:33,012] Trial 170 finished with value: 0.8600000143051147 and parameters: {'n_layers': 3, 'activation_l0': 'tanh', 'n_units_l0': 19, 'dropout_l0': 0.29596595626654004, 'activation_l1': 'selu', 'n_units_l1': 13, 'dropout_l1': 0.40143591626804576, 'activation_l2': 'tanh', 'n_units_l2': 21, 'dropout_l2': 0.3379836186667045}. Best is trial 29 with value: 0.9599999785423279.
[I 2025-03-20 16:33:44,695] Trial 171 finished with value: 0.9200000166893005 and parameters: {'n_layers': 3, 'activation_l0': 'leaky_relu', 'n_units_l0': 6, 'dropout_l0': 0.4691486540755623, 'activation_l1': 'selu', 'n_units_l1': 7, 'dropout_l1': 0.41803971780030014, 'activation_l2': 'tanh', 'n_units_l2': 23, 'dropout_l2': 0.3121705400772005}. Best is trial 29 with value: 0.9599999785423279.
[I 2025-03-20 16:33:55,539] Trial 172 finished with value: 0.9200000166893005 and parameters: {'n_layers': 3, 'activation_l0': 'leaky_relu', 'n_units_l0': 6, 'dropout_l0': 0.25575578948267447, 'activation_l1': 'selu', 'n_units_l1': 8, 'dropout_l1': 0.3377194848064975, 'activation_l2': 'elu', 'n_units_l2': 25, 'dropout_l2': 0.37073845028303337}. Best is trial 29 with value: 0.9599999785423279.
[I 2025-03-20 16:34:02,593] Trial 173 pruned. Trial was pruned at epoch 10.
[I 2025-03-20 16:34:18,251] Trial 174 finished with value: 0.9200000166893005 and parameters: {'n_layers': 3, 'activation_l0': 'leaky_relu', 'n_units_l0': 8, 'dropout_l0': 0.4444306941688725, 'activation_l1': 'elu', 'n_units_l1': 19, 'dropout_l1': 0.3866345763349918, 'activation_l2': 'tanh', 'n_units_l2': 15, 'dropout_l2': 0.38602743757604274}. Best is trial 29 with value: 0.9599999785423279.
[I 2025-03-20 16:34:26,677] Trial 175 finished with value: 0.8999999761581421 and parameters: {'n_layers': 2, 'activation_l0': 'leaky_relu', 'n_units_l0': 31, 'dropout_l0': 0.26954450230829075, 'activation_l1': 'selu', 'n_units_l1': 12, 'dropout_l1': 0.4441038564794357}. Best is trial 29 with value: 0.9599999785423279.
[I 2025-03-20 16:34:34,214] Trial 176 pruned. Trial was pruned at epoch 10.
[I 2025-03-20 16:34:48,323] Trial 177 finished with value: 0.8799999952316284 and parameters: {'n_layers': 3, 'activation_l0': 'tanh', 'n_units_l0': 10, 'dropout_l0': 0.4766111192284059, 'activation_l1': 'leaky_relu', 'n_units_l1': 39, 'dropout_l1': 0.3531066538450759, 'activation_l2': 'elu', 'n_units_l2': 6, 'dropout_l2': 0.32196590088431315}. Best is trial 29 with value: 0.9599999785423279.
[I 2025-03-20 16:35:00,857] Trial 178 finished with value: 0.8999999761581421 and parameters: {'n_layers': 2, 'activation_l0': 'leaky_relu', 'n_units_l0': 33, 'dropout_l0': 0.29173837547693315, 'activation_l1': 'tanh', 'n_units_l1': 69, 'dropout_l1': 0.377468181246298}. Best is trial 29 with value: 0.9599999785423279.
[I 2025-03-20 16:35:14,434] Trial 179 finished with value: 0.8799999952316284 and parameters: {'n_layers': 3, 'activation_l0': 'tanh', 'n_units_l0': 26, 'dropout_l0': 0.22455875412221954, 'activation_l1': 'selu', 'n_units_l1': 6, 'dropout_l1': 0.4264301800428534, 'activation_l2': 'leaky_relu', 'n_units_l2': 19, 'dropout_l2': 0.3554720788587585}. Best is trial 29 with value: 0.9599999785423279.
[I 2025-03-20 16:35:29,935] Trial 180 finished with value: 0.8999999761581421 and parameters: {'n_layers': 3, 'activation_l0': 'leaky_relu', 'n_units_l0': 36, 'dropout_l0': 0.33062531129768824, 'activation_l1': 'elu', 'n_units_l1': 62, 'dropout_l1': 0.4324665303323533, 'activation_l2': 'elu', 'n_units_l2': 14, 'dropout_l2': 0.30715074239368984}. Best is trial 29 with value: 0.9599999785423279.
[I 2025-03-20 16:35:44,188] Trial 181 finished with value: 0.9399999976158142 and parameters: {'n_layers': 2, 'activation_l0': 'tanh', 'n_units_l0': 28, 'dropout_l0': 0.2823960425252504, 'activation_l1': 'elu', 'n_units_l1': 24, 'dropout_l1': 0.39447532747095626}. Best is trial 29 with value: 0.9599999785423279.
[I 2025-03-20 16:35:58,531] Trial 182 finished with value: 0.9200000166893005 and parameters: {'n_layers': 2, 'activation_l0': 'tanh', 'n_units_l0': 28, 'dropout_l0': 0.2833242232507153, 'activation_l1': 'elu', 'n_units_l1': 35, 'dropout_l1': 0.40101799977509245}. Best is trial 29 with value: 0.9599999785423279.
[I 2025-03-20 16:36:10,169] Trial 183 finished with value: 0.9399999976158142 and parameters: {'n_layers': 2, 'activation_l0': 'tanh', 'n_units_l0': 30, 'dropout_l0': 0.2900139833819182, 'activation_l1': 'elu', 'n_units_l1': 48, 'dropout_l1': 0.3956735267711251}. Best is trial 29 with value: 0.9599999785423279.
[I 2025-03-20 16:36:24,893] Trial 184 finished with value: 0.9200000166893005 and parameters: {'n_layers': 2, 'activation_l0': 'tanh', 'n_units_l0': 25, 'dropout_l0': 0.2757209576180348, 'activation_l1': 'elu', 'n_units_l1': 30, 'dropout_l1': 0.39204853295074876}. Best is trial 29 with value: 0.9599999785423279.
[I 2025-03-20 16:36:35,808] Trial 185 finished with value: 0.8799999952316284 and parameters: {'n_layers': 2, 'activation_l0': 'tanh', 'n_units_l0': 30, 'dropout_l0': 0.2873065183205392, 'activation_l1': 'elu', 'n_units_l1': 27, 'dropout_l1': 0.29046591981752184}. Best is trial 29 with value: 0.9599999785423279.
[I 2025-03-20 16:36:48,641] Trial 186 finished with value: 0.8799999952316284 and parameters: {'n_layers': 2, 'activation_l0': 'tanh', 'n_units_l0': 28, 'dropout_l0': 0.28983041079912464, 'activation_l1': 'elu', 'n_units_l1': 18, 'dropout_l1': 0.3843488174301559}. Best is trial 29 with value: 0.9599999785423279.
[I 2025-03-20 16:37:00,261] Trial 187 finished with value: 0.8999999761581421 and parameters: {'n_layers': 2, 'activation_l0': 'tanh', 'n_units_l0': 32, 'dropout_l0': 0.2792298961529329, 'activation_l1': 'elu', 'n_units_l1': 22, 'dropout_l1': 0.4108812736555466}. Best is trial 29 with value: 0.9599999785423279.
[I 2025-03-20 16:37:14,013] Trial 188 finished with value: 0.8999999761581421 and parameters: {'n_layers': 3, 'activation_l0': 'tanh', 'n_units_l0': 12, 'dropout_l0': 0.2967920852126879, 'activation_l1': 'elu', 'n_units_l1': 13, 'dropout_l1': 0.39423701560197816, 'activation_l2': 'relu', 'n_units_l2': 17, 'dropout_l2': 0.28299741818156066}. Best is trial 29 with value: 0.9599999785423279.
[I 2025-03-20 16:37:26,629] Trial 189 finished with value: 0.8799999952316284 and parameters: {'n_layers': 2, 'activation_l0': 'tanh', 'n_units_l0': 23, 'dropout_l0': 0.26451198755335376, 'activation_l1': 'elu', 'n_units_l1': 25, 'dropout_l1': 0.3726225349608727}. Best is trial 29 with value: 0.9599999785423279.
[I 2025-03-20 16:37:36,321] Trial 190 finished with value: 0.8399999737739563 and parameters: {'n_layers': 3, 'activation_l0': 'tanh', 'n_units_l0': 26, 'dropout_l0': 0.49371463413510014, 'activation_l1': 'elu', 'n_units_l1': 15, 'dropout_l1': 0.306497318435919, 'activation_l2': 'tanh', 'n_units_l2': 12, 'dropout_l2': 0.2750040971413111}. Best is trial 29 with value: 0.9599999785423279.
[I 2025-03-20 16:37:52,523] Trial 191 finished with value: 0.9200000166893005 and parameters: {'n_layers': 2, 'activation_l0': 'relu', 'n_units_l0': 30, 'dropout_l0': 0.45841028311081494, 'activation_l1': 'tanh', 'n_units_l1': 45, 'dropout_l1': 0.40092696350577844}. Best is trial 29 with value: 0.9599999785423279.
[I 2025-03-20 16:38:04,840] Trial 192 finished with value: 0.8600000143051147 and parameters: {'n_layers': 2, 'activation_l0': 'tanh', 'n_units_l0': 34, 'dropout_l0': 0.4664553010869143, 'activation_l1': 'selu', 'n_units_l1': 78, 'dropout_l1': 0.3967816764124146}. Best is trial 29 with value: 0.9599999785423279.
[I 2025-03-20 16:38:11,837] Trial 193 pruned. Trial was pruned at epoch 10.
[I 2025-03-20 16:38:23,309] Trial 194 finished with value: 0.9200000166893005 and parameters: {'n_layers': 2, 'activation_l0': 'leaky_relu', 'n_units_l0': 5, 'dropout_l0': 0.2714445756274837, 'activation_l1': 'tanh', 'n_units_l1': 48, 'dropout_l1': 0.41538504369401413}. Best is trial 29 with value: 0.9599999785423279.
[I 2025-03-20 16:38:34,905] Trial 195 finished with value: 0.8799999952316284 and parameters: {'n_layers': 2, 'activation_l0': 'selu', 'n_units_l0': 37, 'dropout_l0': 0.20249248997151154, 'activation_l1': 'elu', 'n_units_l1': 58, 'dropout_l1': 0.4496783194892474}. Best is trial 29 with value: 0.9599999785423279.
[I 2025-03-20 16:38:45,129] Trial 196 finished with value: 0.8600000143051147 and parameters: {'n_layers': 3, 'activation_l0': 'tanh', 'n_units_l0': 21, 'dropout_l0': 0.34643658479255557, 'activation_l1': 'selu', 'n_units_l1': 33, 'dropout_l1': 0.40758318363382584, 'activation_l2': 'elu', 'n_units_l2': 23, 'dropout_l2': 0.3765211422273025}. Best is trial 29 with value: 0.9599999785423279.
[I 2025-03-20 16:38:57,992] Trial 197 finished with value: 0.8999999761581421 and parameters: {'n_layers': 2, 'activation_l0': 'leaky_relu', 'n_units_l0': 58, 'dropout_l0': 0.3144527116205894, 'activation_l1': 'tanh', 'n_units_l1': 89, 'dropout_l1': 0.3777571914396624}. Best is trial 29 with value: 0.9599999785423279.
[I 2025-03-20 16:39:14,454] Trial 198 finished with value: 0.9200000166893005 and parameters: {'n_layers': 3, 'activation_l0': 'tanh', 'n_units_l0': 15, 'dropout_l0': 0.40284946763805074, 'activation_l1': 'relu', 'n_units_l1': 21, 'dropout_l1': 0.3602765745014955, 'activation_l2': 'selu', 'n_units_l2': 8, 'dropout_l2': 0.2922200060861563}. Best is trial 29 with value: 0.9599999785423279.
[I 2025-03-20 16:39:30,539] Trial 199 finished with value: 0.9399999976158142 and parameters: {'n_layers': 3, 'activation_l0': 'leaky_relu', 'n_units_l0': 29, 'dropout_l0': 0.3085810102939168, 'activation_l1': 'selu', 'n_units_l1': 11, 'dropout_l1': 0.3659853197076611, 'activation_l2': 'relu', 'n_units_l2': 46, 'dropout_l2': 0.3015596571947313}. Best is trial 29 with value: 0.9599999785423279.