[I 2025-03-20 16:14:34,362] Trial 82 finished with value: 0.9200000166893005 and parameters: {'n_layers': 3, 'activation_l0': 'leaky_relu', 'n_units_l0': 35, 'dropout_l0': 0.44775945006261025, 'activation_l1': 'tanh', 'n_units_l1': 7, 'dropout_l1': 0.4195730853702628, 'activation_l2': 'elu', 'n_units_l2': 7, 'dropout_l2': 0.32368591917567824}. Best is trial 29 with value: 0.9599999785423279.
[I 2025-03-20 16:14:52,640] Trial 83 finished with value: 0.9200000166893005 and parameters: {'n_layers': 3, 'activation_l0': 'leaky_relu', 'n_units_l0': 49, 'dropout_l0': 0.2609744355980555, 'activation_l1': 'tanh', 'n_units_l1': 15, 'dropout_l1': 0.44528186666177266, 'activation_l2': 'elu', 'n_units_l2': 4, 'dropout_l2': 0.34123147029790235}. Best is trial 29 with value: 0.9599999785423279.
[I 2025-03-20 16:14:59,908] Trial 84 pruned. Trial was pruned at epoch 10.
[I 2025-03-20 16:15:12,245] Trial 85 finished with value: 0.9399999976158142 and parameters: {'n_layers': 3, 'activation_l0': 'leaky_relu', 'n_units_l0': 27, 'dropout_l0': 0.45285316507732665, 'activation_l1': 'selu', 'n_units_l1': 19, 'dropout_l1': 0.3741528530122283, 'activation_l2': 'tanh', 'n_units_l2': 8, 'dropout_l2': 0.3104594296663541}. Best is trial 29 with value: 0.9599999785423279.
[I 2025-03-20 16:15:25,309] Trial 86 finished with value: 0.8999999761581421 and parameters: {'n_layers': 3, 'activation_l0': 'leaky_relu', 'n_units_l0': 30, 'dropout_l0': 0.42863943841280544, 'activation_l1': 'selu', 'n_units_l1': 18, 'dropout_l1': 0.24767014633405898, 'activation_l2': 'tanh', 'n_units_l2': 8, 'dropout_l2': 0.311430046558587}. Best is trial 29 with value: 0.9599999785423279.
[I 2025-03-20 16:15:41,790] Trial 87 finished with value: 0.8600000143051147 and parameters: {'n_layers': 3, 'activation_l0': 'leaky_relu', 'n_units_l0': 26, 'dropout_l0': 0.44001581864680595, 'activation_l1': 'selu', 'n_units_l1': 20, 'dropout_l1': 0.4586391339010736, 'activation_l2': 'tanh', 'n_units_l2': 6, 'dropout_l2': 0.29357484210730933}. Best is trial 29 with value: 0.9599999785423279.
[I 2025-03-20 16:16:00,843] Trial 88 finished with value: 0.8600000143051147 and parameters: {'n_layers': 3, 'activation_l0': 'leaky_relu', 'n_units_l0': 38, 'dropout_l0': 0.4179332497669855, 'activation_l1': 'selu', 'n_units_l1': 10, 'dropout_l1': 0.3787969567200398, 'activation_l2': 'tanh', 'n_units_l2': 5, 'dropout_l2': 0.2639468374187861}. Best is trial 29 with value: 0.9599999785423279.
[I 2025-03-20 16:16:13,297] Trial 89 finished with value: 0.8799999952316284 and parameters: {'n_layers': 3, 'activation_l0': 'leaky_relu', 'n_units_l0': 22, 'dropout_l0': 0.44914898490760696, 'activation_l1': 'selu', 'n_units_l1': 15, 'dropout_l1': 0.2663303868768957, 'activation_l2': 'tanh', 'n_units_l2': 15, 'dropout_l2': 0.33677822589263423}. Best is trial 29 with value: 0.9599999785423279.
[I 2025-03-20 16:16:25,736] Trial 90 finished with value: 0.8999999761581421 and parameters: {'n_layers': 3, 'activation_l0': 'selu', 'n_units_l0': 33, 'dropout_l0': 0.4528958294972425, 'activation_l1': 'selu', 'n_units_l1': 13, 'dropout_l1': 0.23014961493660951, 'activation_l2': 'elu', 'n_units_l2': 6, 'dropout_l2': 0.36992022317955137}. Best is trial 29 with value: 0.9599999785423279.
[I 2025-03-20 16:16:38,144] Trial 91 finished with value: 0.9200000166893005 and parameters: {'n_layers': 3, 'activation_l0': 'leaky_relu', 'n_units_l0': 28, 'dropout_l0': 0.4790475652181719, 'activation_l1': 'elu', 'n_units_l1': 17, 'dropout_l1': 0.3710413672250221, 'activation_l2': 'tanh', 'n_units_l2': 8, 'dropout_l2': 0.35378598246643744}. Best is trial 29 with value: 0.9599999785423279.
[I 2025-03-20 16:16:52,308] Trial 92 finished with value: 0.8600000143051147 and parameters: {'n_layers': 3, 'activation_l0': 'tanh', 'n_units_l0': 35, 'dropout_l0': 0.32367928882478264, 'activation_l1': 'tanh', 'n_units_l1': 23, 'dropout_l1': 0.3985621772137365, 'activation_l2': 'elu', 'n_units_l2': 12, 'dropout_l2': 0.39140296656427465}. Best is trial 29 with value: 0.9599999785423279.
[I 2025-03-20 16:17:08,767] Trial 93 finished with value: 0.8799999952316284 and parameters: {'n_layers': 2, 'activation_l0': 'tanh', 'n_units_l0': 19, 'dropout_l0': 0.46772666259034457, 'activation_l1': 'selu', 'n_units_l1': 19, 'dropout_l1': 0.32939773712967246}. Best is trial 29 with value: 0.9599999785423279.
[I 2025-03-20 16:17:20,902] Trial 94 finished with value: 0.8799999952316284 and parameters: {'n_layers': 3, 'activation_l0': 'elu', 'n_units_l0': 30, 'dropout_l0': 0.4985693893212544, 'activation_l1': 'leaky_relu', 'n_units_l1': 80, 'dropout_l1': 0.3863686079175459, 'activation_l2': 'leaky_relu', 'n_units_l2': 7, 'dropout_l2': 0.3082221841850968}. Best is trial 29 with value: 0.9599999785423279.
[I 2025-03-20 16:17:36,148] Trial 95 finished with value: 0.8799999952316284 and parameters: {'n_layers': 2, 'activation_l0': 'leaky_relu', 'n_units_l0': 15, 'dropout_l0': 0.3396757887712375, 'activation_l1': 'tanh', 'n_units_l1': 5, 'dropout_l1': 0.3602933195702638}. Best is trial 29 with value: 0.9599999785423279.
[I 2025-03-20 16:17:49,710] Trial 96 finished with value: 0.9200000166893005 and parameters: {'n_layers': 3, 'activation_l0': 'tanh', 'n_units_l0': 4, 'dropout_l0': 0.3540462868862596, 'activation_l1': 'selu', 'n_units_l1': 43, 'dropout_l1': 0.35312928663069365, 'activation_l2': 'selu', 'n_units_l2': 4, 'dropout_l2': 0.3295454835291465}. Best is trial 29 with value: 0.9599999785423279.
[I 2025-03-20 16:17:59,715] Trial 97 finished with value: 0.8600000143051147 and parameters: {'n_layers': 2, 'activation_l0': 'selu', 'n_units_l0': 8, 'dropout_l0': 0.4348747763216697, 'activation_l1': 'selu', 'n_units_l1': 6, 'dropout_l1': 0.39245864966186544}. Best is trial 29 with value: 0.9599999785423279.
[I 2025-03-20 16:18:07,415] Trial 98 pruned. Trial was pruned at epoch 10.
[I 2025-03-20 16:18:14,933] Trial 99 pruned. Trial was pruned at epoch 10.
[I 2025-03-20 16:18:28,727] Trial 100 finished with value: 0.8600000143051147 and parameters: {'n_layers': 2, 'activation_l0': 'tanh', 'n_units_l0': 12, 'dropout_l0': 0.27859963982061803, 'activation_l1': 'selu', 'n_units_l1': 26, 'dropout_l1': 0.3447443206367996}. Best is trial 29 with value: 0.9599999785423279.
[I 2025-03-20 16:18:41,769] Trial 101 finished with value: 0.8999999761581421 and parameters: {'n_layers': 3, 'activation_l0': 'leaky_relu', 'n_units_l0': 26, 'dropout_l0': 0.29302131268514836, 'activation_l1': 'elu', 'n_units_l1': 8, 'dropout_l1': 0.40114018792490136, 'activation_l2': 'elu', 'n_units_l2': 16, 'dropout_l2': 0.28076376778187273}. Best is trial 29 with value: 0.9599999785423279.
[I 2025-03-20 16:18:56,591] Trial 102 finished with value: 0.8999999761581421 and parameters: {'n_layers': 3, 'activation_l0': 'leaky_relu', 'n_units_l0': 32, 'dropout_l0': 0.31003412768127747, 'activation_l1': 'elu', 'n_units_l1': 32, 'dropout_l1': 0.37623246245729347, 'activation_l2': 'elu', 'n_units_l2': 22, 'dropout_l2': 0.30126350504191873}. Best is trial 29 with value: 0.9599999785423279.
[I 2025-03-20 16:19:11,888] Trial 103 finished with value: 0.9399999976158142 and parameters: {'n_layers': 3, 'activation_l0': 'leaky_relu', 'n_units_l0': 46, 'dropout_l0': 0.28019864664696675, 'activation_l1': 'elu', 'n_units_l1': 12, 'dropout_l1': 0.36520297060139323, 'activation_l2': 'elu', 'n_units_l2': 14, 'dropout_l2': 0.3177104643527883}. Best is trial 29 with value: 0.9599999785423279.
[I 2025-03-20 16:19:26,224] Trial 104 finished with value: 0.9200000166893005 and parameters: {'n_layers': 3, 'activation_l0': 'leaky_relu', 'n_units_l0': 45, 'dropout_l0': 0.26653622288459483, 'activation_l1': 'elu', 'n_units_l1': 12, 'dropout_l1': 0.36662435518952824, 'activation_l2': 'elu', 'n_units_l2': 14, 'dropout_l2': 0.3183756311707441}. Best is trial 29 with value: 0.9599999785423279.
[I 2025-03-20 16:19:41,384] Trial 105 finished with value: 0.8799999952316284 and parameters: {'n_layers': 3, 'activation_l0': 'leaky_relu', 'n_units_l0': 42, 'dropout_l0': 0.28100940110865597, 'activation_l1': 'elu', 'n_units_l1': 16, 'dropout_l1': 0.3842291854440312, 'activation_l2': 'elu', 'n_units_l2': 11, 'dropout_l2': 0.343566200779018}. Best is trial 29 with value: 0.9599999785423279.
[I 2025-03-20 16:20:01,612] Trial 106 finished with value: 0.8999999761581421 and parameters: {'n_layers': 3, 'activation_l0': 'tanh', 'n_units_l0': 47, 'dropout_l0': 0.3026453837039865, 'activation_l1': 'relu', 'n_units_l1': 13, 'dropout_l1': 0.3188506567813796, 'activation_l2': 'elu', 'n_units_l2': 9, 'dropout_l2': 0.42332754068856365}. Best is trial 29 with value: 0.9599999785423279.
[I 2025-03-20 16:20:20,056] Trial 107 finished with value: 0.8600000143051147 and parameters: {'n_layers': 2, 'activation_l0': 'tanh', 'n_units_l0': 54, 'dropout_l0': 0.2518986428352501, 'activation_l1': 'tanh', 'n_units_l1': 14, 'dropout_l1': 0.3732680276953841}. Best is trial 29 with value: 0.9599999785423279.
[I 2025-03-20 16:20:37,944] Trial 108 finished with value: 0.8799999952316284 and parameters: {'n_layers': 3, 'activation_l0': 'elu', 'n_units_l0': 36, 'dropout_l0': 0.317761533876485, 'activation_l1': 'selu', 'n_units_l1': 9, 'dropout_l1': 0.4405799932319378, 'activation_l2': 'selu', 'n_units_l2': 19, 'dropout_l2': 0.31387200876584564}. Best is trial 29 with value: 0.9599999785423279.
[I 2025-03-20 16:20:55,364] Trial 109 finished with value: 0.8600000143051147 and parameters: {'n_layers': 3, 'activation_l0': 'selu', 'n_units_l0': 9, 'dropout_l0': 0.4798043844926311, 'activation_l1': 'tanh', 'n_units_l1': 20, 'dropout_l1': 0.4684501649137942, 'activation_l2': 'tanh', 'n_units_l2': 25, 'dropout_l2': 0.32689247585071896}. Best is trial 29 with value: 0.9599999785423279.
[I 2025-03-20 16:21:03,967] Trial 110 pruned. Trial was pruned at epoch 14.
[I 2025-03-20 16:21:19,448] Trial 111 finished with value: 0.9200000166893005 and parameters: {'n_layers': 3, 'activation_l0': 'leaky_relu', 'n_units_l0': 29, 'dropout_l0': 0.28667679351200315, 'activation_l1': 'elu', 'n_units_l1': 7, 'dropout_l1': 0.3952799790742486, 'activation_l2': 'elu', 'n_units_l2': 17, 'dropout_l2': 0.29891917297483034}. Best is trial 29 with value: 0.9599999785423279.
[I 2025-03-20 16:21:34,113] Trial 112 finished with value: 0.8799999952316284 and parameters: {'n_layers': 3, 'activation_l0': 'leaky_relu', 'n_units_l0': 37, 'dropout_l0': 0.4435231016866875, 'activation_l1': 'elu', 'n_units_l1': 15, 'dropout_l1': 0.3635579963832587, 'activation_l2': 'elu', 'n_units_l2': 20, 'dropout_l2': 0.3579933577877686}. Best is trial 29 with value: 0.9599999785423279.
[I 2025-03-20 16:21:49,231] Trial 113 finished with value: 0.8799999952316284 and parameters: {'n_layers': 3, 'activation_l0': 'leaky_relu', 'n_units_l0': 63, 'dropout_l0': 0.2746584289070183, 'activation_l1': 'elu', 'n_units_l1': 11, 'dropout_l1': 0.40560400288825404, 'activation_l2': 'elu', 'n_units_l2': 12, 'dropout_l2': 0.26549812839966175}. Best is trial 29 with value: 0.9599999785423279.
[I 2025-03-20 16:21:58,400] Trial 114 finished with value: 0.8999999761581421 and parameters: {'n_layers': 3, 'activation_l0': 'leaky_relu', 'n_units_l0': 16, 'dropout_l0': 0.3005234316401321, 'activation_l1': 'elu', 'n_units_l1': 5, 'dropout_l1': 0.3875236371382385, 'activation_l2': 'elu', 'n_units_l2': 15, 'dropout_l2': 0.2930185984192745}. Best is trial 29 with value: 0.9599999785423279.
[I 2025-03-20 16:22:08,642] Trial 115 finished with value: 0.8600000143051147 and parameters: {'n_layers': 3, 'activation_l0': 'tanh', 'n_units_l0': 24, 'dropout_l0': 0.42388700247692745, 'activation_l1': 'selu', 'n_units_l1': 12, 'dropout_l1': 0.41260741098171394, 'activation_l2': 'elu', 'n_units_l2': 10, 'dropout_l2': 0.30678397999630985}. Best is trial 29 with value: 0.9599999785423279.
[I 2025-03-20 16:22:25,482] Trial 116 finished with value: 0.8999999761581421 and parameters: {'n_layers': 3, 'activation_l0': 'leaky_relu', 'n_units_l0': 30, 'dropout_l0': 0.4544820870249264, 'activation_l1': 'leaky_relu', 'n_units_l1': 6, 'dropout_l1': 0.4344211944309099, 'activation_l2': 'leaky_relu', 'n_units_l2': 21, 'dropout_l2': 0.3369039189110598}. Best is trial 29 with value: 0.9599999785423279.
[I 2025-03-20 16:22:43,677] Trial 117 finished with value: 0.8799999952316284 and parameters: {'n_layers': 2, 'activation_l0': 'tanh', 'n_units_l0': 27, 'dropout_l0': 0.26949823569077075, 'activation_l1': 'tanh', 'n_units_l1': 7, 'dropout_l1': 0.33323107263794}. Best is trial 29 with value: 0.9599999785423279.
[I 2025-03-20 16:22:57,811] Trial 118 finished with value: 0.8999999761581421 and parameters: {'n_layers': 3, 'activation_l0': 'leaky_relu', 'n_units_l0': 33, 'dropout_l0': 0.40853518546960593, 'activation_l1': 'selu', 'n_units_l1': 16, 'dropout_l1': 0.426040673976456, 'activation_l2': 'elu', 'n_units_l2': 34, 'dropout_l2': 0.28481459025480627}. Best is trial 29 with value: 0.9599999785423279.
[I 2025-03-20 16:23:11,081] Trial 119 finished with value: 0.8399999737739563 and parameters: {'n_layers': 3, 'activation_l0': 'tanh', 'n_units_l0': 22, 'dropout_l0': 0.41445560803844483, 'activation_l1': 'tanh', 'n_units_l1': 21, 'dropout_l1': 0.45418964557459324, 'activation_l2': 'selu', 'n_units_l2': 14, 'dropout_l2': 0.3211986560072287}. Best is trial 29 with value: 0.9599999785423279.
[I 2025-03-20 16:23:17,967] Trial 120 pruned. Trial was pruned at epoch 10.
[I 2025-03-20 16:23:30,297] Trial 121 finished with value: 0.8999999761581421 and parameters: {'n_layers': 2, 'activation_l0': 'leaky_relu', 'n_units_l0': 5, 'dropout_l0': 0.20191607992353208, 'activation_l1': 'tanh', 'n_units_l1': 36, 'dropout_l1': 0.47641710277101446}. Best is trial 29 with value: 0.9599999785423279.
[I 2025-03-20 16:23:41,305] Trial 122 finished with value: 0.8799999952316284 and parameters: {'n_layers': 2, 'activation_l0': 'leaky_relu', 'n_units_l0': 6, 'dropout_l0': 0.21982435609334758, 'activation_l1': 'tanh', 'n_units_l1': 46, 'dropout_l1': 0.48375131563822793}. Best is trial 29 with value: 0.9599999785423279.
[I 2025-03-20 16:23:54,068] Trial 123 finished with value: 0.9200000166893005 and parameters: {'n_layers': 2, 'activation_l0': 'leaky_relu', 'n_units_l0': 6, 'dropout_l0': 0.3791994094670281, 'activation_l1': 'tanh', 'n_units_l1': 57, 'dropout_l1': 0.46128480105343533}. Best is trial 29 with value: 0.9599999785423279.
[I 2025-03-20 16:24:06,849] Trial 124 finished with value: 0.8799999952316284 and parameters: {'n_layers': 2, 'activation_l0': 'leaky_relu', 'n_units_l0': 31, 'dropout_l0': 0.2409552651018195, 'activation_l1': 'tanh', 'n_units_l1': 51, 'dropout_l1': 0.3903428270196484}. Best is trial 29 with value: 0.9599999785423279.
[I 2025-03-20 16:24:16,558] Trial 125 finished with value: 0.8600000143051147 and parameters: {'n_layers': 2, 'activation_l0': 'selu', 'n_units_l0': 40, 'dropout_l0': 0.25834360049676885, 'activation_l1': 'selu', 'n_units_l1': 17, 'dropout_l1': 0.37999254240582286}. Best is trial 29 with value: 0.9599999785423279.
[I 2025-03-20 16:24:30,498] Trial 126 finished with value: 0.9200000166893005 and parameters: {'n_layers': 2, 'activation_l0': 'leaky_relu', 'n_units_l0': 20, 'dropout_l0': 0.44681845782332374, 'activation_l1': 'tanh', 'n_units_l1': 56, 'dropout_l1': 0.4921668349383776}. Best is trial 29 with value: 0.9599999785423279.
[I 2025-03-20 16:24:45,950] Trial 127 finished with value: 0.9399999976158142 and parameters: {'n_layers': 3, 'activation_l0': 'tanh', 'n_units_l0': 11, 'dropout_l0': 0.4590639630365993, 'activation_l1': 'selu', 'n_units_l1': 70, 'dropout_l1': 0.303956075088405, 'activation_l2': 'relu', 'n_units_l2': 11, 'dropout_l2': 0.34739767538706723}. Best is trial 29 with value: 0.9599999785423279.
[I 2025-03-20 16:25:03,155] Trial 128 finished with value: 0.9399999976158142 and parameters: {'n_layers': 3, 'activation_l0': 'tanh', 'n_units_l0': 10, 'dropout_l0': 0.28600196364150127, 'activation_l1': 'selu', 'n_units_l1': 78, 'dropout_l1': 0.35511919663091196, 'activation_l2': 'relu', 'n_units_l2': 11, 'dropout_l2': 0.3765931266714914}. Best is trial 29 with value: 0.9599999785423279.
[I 2025-03-20 16:25:19,247] Trial 129 finished with value: 0.8799999952316284 and parameters: {'n_layers': 3, 'activation_l0': 'tanh', 'n_units_l0': 12, 'dropout_l0': 0.4557717330603501, 'activation_l1': 'selu', 'n_units_l1': 86, 'dropout_l1': 0.30450611740197736, 'activation_l2': 'relu', 'n_units_l2': 11, 'dropout_l2': 0.3780929834457049}. Best is trial 29 with value: 0.9599999785423279.
[I 2025-03-20 16:25:28,185] Trial 130 pruned. Trial was pruned at epoch 10.
[I 2025-03-20 16:25:44,012] Trial 131 finished with value: 0.9399999976158142 and parameters: {'n_layers': 3, 'activation_l0': 'tanh', 'n_units_l0': 14, 'dropout_l0': 0.47120320289490664, 'activation_l1': 'selu', 'n_units_l1': 77, 'dropout_l1': 0.29676279685858314, 'activation_l2': 'relu', 'n_units_l2': 13, 'dropout_l2': 0.34838968700959316}. Best is trial 29 with value: 0.9599999785423279.
[I 2025-03-20 16:25:54,681] Trial 132 finished with value: 0.8799999952316284 and parameters: {'n_layers': 3, 'activation_l0': 'tanh', 'n_units_l0': 14, 'dropout_l0': 0.46204474789589756, 'activation_l1': 'selu', 'n_units_l1': 72, 'dropout_l1': 0.3451991206467621, 'activation_l2': 'relu', 'n_units_l2': 13, 'dropout_l2': 0.393632240617015}. Best is trial 29 with value: 0.9599999785423279.
[I 2025-03-20 16:26:09,013] Trial 133 finished with value: 0.9200000166893005 and parameters: {'n_layers': 3, 'activation_l0': 'tanh', 'n_units_l0': 11, 'dropout_l0': 0.472194460172054, 'activation_l1': 'selu', 'n_units_l1': 98, 'dropout_l1': 0.3051225167171786, 'activation_l2': 'relu', 'n_units_l2': 11, 'dropout_l2': 0.34827735286384204}. Best is trial 29 with value: 0.9599999785423279.
[I 2025-03-20 16:26:22,839] Trial 134 finished with value: 0.8799999952316284 and parameters: {'n_layers': 3, 'activation_l0': 'tanh', 'n_units_l0': 10, 'dropout_l0': 0.49321945168407594, 'activation_l1': 'selu', 'n_units_l1': 81, 'dropout_l1': 0.2725338935382684, 'activation_l2': 'relu', 'n_units_l2': 10, 'dropout_l2': 0.3655384689924533}. Best is trial 29 with value: 0.9599999785423279.
[I 2025-03-20 16:26:33,435] Trial 135 pruned. Trial was pruned at epoch 14.
[I 2025-03-20 16:26:43,471] Trial 136 pruned. Trial was pruned at epoch 14.
[I 2025-03-20 16:26:54,020] Trial 137 pruned. Trial was pruned at epoch 14.
[I 2025-03-20 16:27:04,327] Trial 138 pruned. Trial was pruned at epoch 14.
[I 2025-03-20 16:27:13,473] Trial 139 pruned. Trial was pruned at epoch 10.
[I 2025-03-20 16:27:30,146] Trial 140 finished with value: 0.8399999737739563 and parameters: {'n_layers': 3, 'activation_l0': 'tanh', 'n_units_l0': 10, 'dropout_l0': 0.45768958641655133, 'activation_l1': 'selu', 'n_units_l1': 85, 'dropout_l1': 0.339567969222324, 'activation_l2': 'tanh', 'n_units_l2': 13, 'dropout_l2': 0.3340421029253194}. Best is trial 29 with value: 0.9599999785423279.
[I 2025-03-20 16:27:48,450] Trial 141 finished with value: 0.9200000166893005 and parameters: {'n_layers': 3, 'activation_l0': 'tanh', 'n_units_l0': 11, 'dropout_l0': 0.2849223366707286, 'activation_l1': 'selu', 'n_units_l1': 65, 'dropout_l1': 0.35308980686544306, 'activation_l2': 'relu', 'n_units_l2': 16, 'dropout_l2': 0.32707736630693}. Best is trial 29 with value: 0.9599999785423279.
[I 2025-03-20 16:27:58,398] Trial 142 pruned. Trial was pruned at epoch 14.
[I 2025-03-20 16:28:06,107] Trial 143 pruned. Trial was pruned at epoch 10.
[I 2025-03-20 16:28:14,570] Trial 144 pruned. Trial was pruned at epoch 14.
[I 2025-03-20 16:28:26,985] Trial 145 finished with value: 0.8600000143051147 and parameters: {'n_layers': 3, 'activation_l0': 'selu', 'n_units_l0': 34, 'dropout_l0': 0.46399955433450346, 'activation_l1': 'selu', 'n_units_l1': 6, 'dropout_l1': 0.44634400242959915, 'activation_l2': 'elu', 'n_units_l2': 15, 'dropout_l2': 0.362732813406871}. Best is trial 29 with value: 0.9599999785423279.
[I 2025-03-20 16:28:39,080] Trial 146 finished with value: 0.8999999761581421 and parameters: {'n_layers': 3, 'activation_l0': 'tanh', 'n_units_l0': 4, 'dropout_l0': 0.26498664252052306, 'activation_l1': 'selu', 'n_units_l1': 15, 'dropout_l1': 0.40922660838065217, 'activation_l2': 'elu', 'n_units_l2': 26, 'dropout_l2': 0.32249069623044246}. Best is trial 29 with value: 0.9599999785423279.
[I 2025-03-20 16:28:52,080] Trial 147 finished with value: 0.8600000143051147 and parameters: {'n_layers': 3, 'activation_l0': 'tanh', 'n_units_l0': 9, 'dropout_l0': 0.2995868626599786, 'activation_l1': 'leaky_relu', 'n_units_l1': 19, 'dropout_l1': 0.3116806003181577, 'activation_l2': 'tanh', 'n_units_l2': 11, 'dropout_l2': 0.35491105501650955}. Best is trial 29 with value: 0.9599999785423279.
[I 2025-03-20 16:28:59,655] Trial 148 pruned. Trial was pruned at epoch 10.
[I 2025-03-20 16:29:12,363] Trial 149 finished with value: 0.8999999761581421 and parameters: {'n_layers': 3, 'activation_l0': 'leaky_relu', 'n_units_l0': 42, 'dropout_l0': 0.4394240821845893, 'activation_l1': 'selu', 'n_units_l1': 69, 'dropout_l1': 0.37974303396033116, 'activation_l2': 'leaky_relu', 'n_units_l2': 12, 'dropout_l2': 0.3473445282832892}. Best is trial 29 with value: 0.9599999785423279.
[I 2025-03-20 16:29:19,757] Trial 150 pruned. Trial was pruned at epoch 10.
[I 2025-03-20 16:29:27,004] Trial 151 pruned. Trial was pruned at epoch 10.
[I 2025-03-20 16:29:39,568] Trial 152 finished with value: 0.8999999761581421 and parameters: {'n_layers': 2, 'activation_l0': 'leaky_relu', 'n_units_l0': 13, 'dropout_l0': 0.24824980430200033, 'activation_l1': 'tanh', 'n_units_l1': 108, 'dropout_l1': 0.4155571596252958}. Best is trial 29 with value: 0.9599999785423279.
[I 2025-03-20 16:29:53,905] Trial 153 finished with value: 0.8999999761581421 and parameters: {'n_layers': 2, 'activation_l0': 'leaky_relu', 'n_units_l0': 25, 'dropout_l0': 0.2148491264031969, 'activation_l1': 'tanh', 'n_units_l1': 12, 'dropout_l1': 0.390945072730158}. Best is trial 29 with value: 0.9599999785423279.
