[I 2025-03-20 16:00:14,235] A new study created in memory with name: no-name-f8758eca-23e6-4b05-adf1-d0e5778d9f5a
[I 2025-03-20 16:00:22,044] Trial 0 finished with value: 0.9200000166893005 and parameters: {'n_layers': 3, 'activation_l0': 'tanh', 'n_units_l0': 14, 'dropout_l0': 0.49226823353187726, 'activation_l1': 'selu', 'n_units_l1': 7, 'dropout_l1': 0.33384986990409016, 'activation_l2': 'selu', 'n_units_l2': 4, 'dropout_l2': 0.33659352872870796}. Best is trial 0 with value: 0.9200000166893005.
[I 2025-03-20 16:00:29,669] Trial 1 finished with value: 0.8199999928474426 and parameters: {'n_layers': 2, 'activation_l0': 'selu', 'n_units_l0': 6, 'dropout_l0': 0.3673755370661492, 'activation_l1': 'relu', 'n_units_l1': 9, 'dropout_l1': 0.4483921585251164}. Best is trial 0 with value: 0.9200000166893005.
[I 2025-03-20 16:00:39,189] Trial 2 finished with value: 0.9399999976158142 and parameters: {'n_layers': 2, 'activation_l0': 'leaky_relu', 'n_units_l0': 33, 'dropout_l0': 0.3635324940227522, 'activation_l1': 'selu', 'n_units_l1': 14, 'dropout_l1': 0.39475637757696613}. Best is trial 2 with value: 0.9399999976158142.
[I 2025-03-20 16:00:49,019] Trial 3 finished with value: 0.8600000143051147 and parameters: {'n_layers': 3, 'activation_l0': 'elu', 'n_units_l0': 15, 'dropout_l0': 0.46322991699904476, 'activation_l1': 'selu', 'n_units_l1': 12, 'dropout_l1': 0.3866868907953629, 'activation_l2': 'leaky_relu', 'n_units_l2': 12, 'dropout_l2': 0.28854043176120225}. Best is trial 2 with value: 0.9399999976158142.
[I 2025-03-20 16:00:58,287] Trial 4 finished with value: 0.8999999761581421 and parameters: {'n_layers': 3, 'activation_l0': 'selu', 'n_units_l0': 78, 'dropout_l0': 0.2148875926917062, 'activation_l1': 'relu', 'n_units_l1': 67, 'dropout_l1': 0.39979534765119995, 'activation_l2': 'selu', 'n_units_l2': 104, 'dropout_l2': 0.49560266452803353}. Best is trial 2 with value: 0.9399999976158142.
[I 2025-03-20 16:01:06,235] Trial 5 finished with value: 0.8799999952316284 and parameters: {'n_layers': 2, 'activation_l0': 'selu', 'n_units_l0': 7, 'dropout_l0': 0.24452684542655478, 'activation_l1': 'leaky_relu', 'n_units_l1': 5, 'dropout_l1': 0.4876735475166537}. Best is trial 2 with value: 0.9399999976158142.
[I 2025-03-20 16:01:17,006] Trial 6 finished with value: 0.9200000166893005 and parameters: {'n_layers': 2, 'activation_l0': 'tanh', 'n_units_l0': 4, 'dropout_l0': 0.4598186908632603, 'activation_l1': 'tanh', 'n_units_l1': 19, 'dropout_l1': 0.4319994078530406}. Best is trial 2 with value: 0.9399999976158142.
[I 2025-03-20 16:01:25,512] Trial 7 finished with value: 0.8799999952316284 and parameters: {'n_layers': 3, 'activation_l0': 'leaky_relu', 'n_units_l0': 27, 'dropout_l0': 0.4455531127944846, 'activation_l1': 'leaky_relu', 'n_units_l1': 5, 'dropout_l1': 0.42485291986698004, 'activation_l2': 'selu', 'n_units_l2': 4, 'dropout_l2': 0.3839108804543383}. Best is trial 2 with value: 0.9399999976158142.
[I 2025-03-20 16:01:36,872] Trial 8 finished with value: 0.8600000143051147 and parameters: {'n_layers': 3, 'activation_l0': 'elu', 'n_units_l0': 8, 'dropout_l0': 0.2951640397277067, 'activation_l1': 'elu', 'n_units_l1': 28, 'dropout_l1': 0.4279053130327235, 'activation_l2': 'relu', 'n_units_l2': 13, 'dropout_l2': 0.34754408818112914}. Best is trial 2 with value: 0.9399999976158142.
[I 2025-03-20 16:01:48,469] Trial 9 finished with value: 0.8600000143051147 and parameters: {'n_layers': 3, 'activation_l0': 'leaky_relu', 'n_units_l0': 7, 'dropout_l0': 0.20959939361193614, 'activation_l1': 'tanh', 'n_units_l1': 60, 'dropout_l1': 0.34402994613246746, 'activation_l2': 'tanh', 'n_units_l2': 6, 'dropout_l2': 0.3607281745409098}. Best is trial 2 with value: 0.9399999976158142.
[I 2025-03-20 16:01:59,125] Trial 10 finished with value: 0.8799999952316284 and parameters: {'n_layers': 2, 'activation_l0': 'relu', 'n_units_l0': 51, 'dropout_l0': 0.36880268007704675, 'activation_l1': 'selu', 'n_units_l1': 32, 'dropout_l1': 0.24556641030565707}. Best is trial 2 with value: 0.9399999976158142.
[I 2025-03-20 16:02:13,069] Trial 11 finished with value: 0.8600000143051147 and parameters: {'n_layers': 2, 'activation_l0': 'tanh', 'n_units_l0': 24, 'dropout_l0': 0.49920676924663687, 'activation_l1': 'selu', 'n_units_l1': 9, 'dropout_l1': 0.3129539897662109}. Best is trial 2 with value: 0.9399999976158142.
[I 2025-03-20 16:02:24,304] Trial 12 finished with value: 0.8999999761581421 and parameters: {'n_layers': 3, 'activation_l0': 'leaky_relu', 'n_units_l0': 15, 'dropout_l0': 0.4125983724452287, 'activation_l1': 'selu', 'n_units_l1': 14, 'dropout_l1': 0.2840597746646056, 'activation_l2': 'elu', 'n_units_l2': 43, 'dropout_l2': 0.2074015627508609}. Best is trial 2 with value: 0.9399999976158142.
[I 2025-03-20 16:02:39,816] Trial 13 finished with value: 0.8999999761581421 and parameters: {'n_layers': 2, 'activation_l0': 'tanh', 'n_units_l0': 46, 'dropout_l0': 0.31322720697879003, 'activation_l1': 'selu', 'n_units_l1': 4, 'dropout_l1': 0.35502444324409205}. Best is trial 2 with value: 0.9399999976158142.
[I 2025-03-20 16:02:45,919] Trial 14 pruned. Trial was pruned at epoch 10.
[I 2025-03-20 16:02:54,529] Trial 15 finished with value: 0.8999999761581421 and parameters: {'n_layers': 2, 'activation_l0': 'leaky_relu', 'n_units_l0': 112, 'dropout_l0': 0.3201629157256166, 'activation_l1': 'selu', 'n_units_l1': 38, 'dropout_l1': 0.2035962083271239}. Best is trial 2 with value: 0.9399999976158142.
[I 2025-03-20 16:03:07,177] Trial 16 finished with value: 0.8999999761581421 and parameters: {'n_layers': 2, 'activation_l0': 'tanh', 'n_units_l0': 34, 'dropout_l0': 0.27101698385235834, 'activation_l1': 'selu', 'n_units_l1': 17, 'dropout_l1': 0.35722921128720814}. Best is trial 2 with value: 0.9399999976158142.
[I 2025-03-20 16:03:16,564] Trial 17 finished with value: 0.8999999761581421 and parameters: {'n_layers': 3, 'activation_l0': 'leaky_relu', 'n_units_l0': 13, 'dropout_l0': 0.4083403754731504, 'activation_l1': 'selu', 'n_units_l1': 97, 'dropout_l1': 0.47903723698503403, 'activation_l2': 'leaky_relu', 'n_units_l2': 8, 'dropout_l2': 0.25687076407651693}. Best is trial 2 with value: 0.9399999976158142.
[I 2025-03-20 16:03:23,609] Trial 18 pruned. Trial was pruned at epoch 10.
[I 2025-03-20 16:03:36,903] Trial 19 finished with value: 0.8799999952316284 and parameters: {'n_layers': 2, 'activation_l0': 'elu', 'n_units_l0': 62, 'dropout_l0': 0.33735675696707856, 'activation_l1': 'tanh', 'n_units_l1': 10, 'dropout_l1': 0.3158852656665553}. Best is trial 2 with value: 0.9399999976158142.
[I 2025-03-20 16:03:50,634] Trial 20 finished with value: 0.8999999761581421 and parameters: {'n_layers': 2, 'activation_l0': 'relu', 'n_units_l0': 21, 'dropout_l0': 0.3857038396068479, 'activation_l1': 'leaky_relu', 'n_units_l1': 21, 'dropout_l1': 0.25364722100742076}. Best is trial 2 with value: 0.9399999976158142.
[I 2025-03-20 16:03:56,999] Trial 21 pruned. Trial was pruned at epoch 10.
[I 2025-03-20 16:04:09,169] Trial 22 finished with value: 0.9200000166893005 and parameters: {'n_layers': 2, 'activation_l0': 'tanh', 'n_units_l0': 4, 'dropout_l0': 0.43861342924703817, 'activation_l1': 'tanh', 'n_units_l1': 15, 'dropout_l1': 0.4021567144515794}. Best is trial 2 with value: 0.9399999976158142.
[I 2025-03-20 16:04:22,324] Trial 23 finished with value: 0.9200000166893005 and parameters: {'n_layers': 2, 'activation_l0': 'tanh', 'n_units_l0': 11, 'dropout_l0': 0.47567681120936567, 'activation_l1': 'tanh', 'n_units_l1': 41, 'dropout_l1': 0.373462506218561}. Best is trial 2 with value: 0.9399999976158142.
[I 2025-03-20 16:04:28,653] Trial 24 pruned. Trial was pruned at epoch 10.
[I 2025-03-20 16:04:39,407] Trial 25 finished with value: 0.8799999952316284 and parameters: {'n_layers': 2, 'activation_l0': 'leaky_relu', 'n_units_l0': 10, 'dropout_l0': 0.4764545561196822, 'activation_l1': 'tanh', 'n_units_l1': 27, 'dropout_l1': 0.41446430344865}. Best is trial 2 with value: 0.9399999976158142.
[I 2025-03-20 16:04:50,753] Trial 26 finished with value: 0.9399999976158142 and parameters: {'n_layers': 3, 'activation_l0': 'tanh', 'n_units_l0': 5, 'dropout_l0': 0.4248033303178603, 'activation_l1': 'selu', 'n_units_l1': 13, 'dropout_l1': 0.4550187317627894, 'activation_l2': 'tanh', 'n_units_l2': 18, 'dropout_l2': 0.3087293968731022}. Best is trial 2 with value: 0.9399999976158142.
[I 2025-03-20 16:05:05,953] Trial 27 finished with value: 0.8999999761581421 and parameters: {'n_layers': 3, 'activation_l0': 'tanh', 'n_units_l0': 32, 'dropout_l0': 0.35361532200726165, 'activation_l1': 'selu', 'n_units_l1': 11, 'dropout_l1': 0.463674715782177, 'activation_l2': 'tanh', 'n_units_l2': 18, 'dropout_l2': 0.3198855125866249}. Best is trial 2 with value: 0.9399999976158142.
[I 2025-03-20 16:05:11,772] Trial 28 pruned. Trial was pruned at epoch 10.
[I 2025-03-20 16:05:22,194] Trial 29 finished with value: 0.9599999785423279 and parameters: {'n_layers': 3, 'activation_l0': 'selu', 'n_units_l0': 5, 'dropout_l0': 0.420178915490353, 'activation_l1': 'selu', 'n_units_l1': 13, 'dropout_l1': 0.4489642579418174, 'activation_l2': 'elu', 'n_units_l2': 24, 'dropout_l2': 0.40270447178276747}. Best is trial 29 with value: 0.9599999785423279.
[I 2025-03-20 16:05:31,769] Trial 30 pruned. Trial was pruned at epoch 31.
[I 2025-03-20 16:05:40,197] Trial 31 pruned. Trial was pruned at epoch 31.
[I 2025-03-20 16:05:45,862] Trial 32 pruned. Trial was pruned at epoch 10.
[I 2025-03-20 16:05:52,109] Trial 33 pruned. Trial was pruned at epoch 10.
[I 2025-03-20 16:05:57,810] Trial 34 pruned. Trial was pruned at epoch 10.
[I 2025-03-20 16:06:03,657] Trial 35 pruned. Trial was pruned at epoch 10.
[I 2025-03-20 16:06:14,885] Trial 36 finished with value: 0.800000011920929 and parameters: {'n_layers': 3, 'activation_l0': 'selu', 'n_units_l0': 73, 'dropout_l0': 0.4526072676530709, 'activation_l1': 'leaky_relu', 'n_units_l1': 5, 'dropout_l1': 0.37017022209916306, 'activation_l2': 'tanh', 'n_units_l2': 20, 'dropout_l2': 0.24941262516932514}. Best is trial 29 with value: 0.9599999785423279.
[I 2025-03-20 16:06:21,332] Trial 37 pruned. Trial was pruned at epoch 10.
[I 2025-03-20 16:06:27,305] Trial 38 pruned. Trial was pruned at epoch 10.
[I 2025-03-20 16:06:33,784] Trial 39 pruned. Trial was pruned at epoch 10.
[I 2025-03-20 16:06:50,047] Trial 40 finished with value: 0.9399999976158142 and parameters: {'n_layers': 3, 'activation_l0': 'leaky_relu', 'n_units_l0': 30, 'dropout_l0': 0.28567666693114036, 'activation_l1': 'elu', 'n_units_l1': 6, 'dropout_l1': 0.3931889604383383, 'activation_l2': 'elu', 'n_units_l2': 14, 'dropout_l2': 0.2949531800521987}. Best is trial 29 with value: 0.9599999785423279.
[I 2025-03-20 16:07:10,483] Trial 41 finished with value: 0.9200000166893005 and parameters: {'n_layers': 3, 'activation_l0': 'leaky_relu', 'n_units_l0': 29, 'dropout_l0': 0.2819423445804434, 'activation_l1': 'elu', 'n_units_l1': 6, 'dropout_l1': 0.4029318192624209, 'activation_l2': 'elu', 'n_units_l2': 16, 'dropout_l2': 0.3043249574355955}. Best is trial 29 with value: 0.9599999785423279.
[I 2025-03-20 16:07:23,398] Trial 42 finished with value: 0.8999999761581421 and parameters: {'n_layers': 3, 'activation_l0': 'leaky_relu', 'n_units_l0': 25, 'dropout_l0': 0.26036864218159694, 'activation_l1': 'elu', 'n_units_l1': 5, 'dropout_l1': 0.3857990904993286, 'activation_l2': 'elu', 'n_units_l2': 22, 'dropout_l2': 0.27688117277583585}. Best is trial 29 with value: 0.9599999785423279.
[I 2025-03-20 16:07:33,433] Trial 43 finished with value: 0.8600000143051147 and parameters: {'n_layers': 3, 'activation_l0': 'leaky_relu', 'n_units_l0': 43, 'dropout_l0': 0.32592332451221895, 'activation_l1': 'elu', 'n_units_l1': 8, 'dropout_l1': 0.43935801229062504, 'activation_l2': 'elu', 'n_units_l2': 11, 'dropout_l2': 0.3662316640787162}. Best is trial 29 with value: 0.9599999785423279.
[I 2025-03-20 16:07:46,851] Trial 44 finished with value: 0.8999999761581421 and parameters: {'n_layers': 3, 'activation_l0': 'leaky_relu', 'n_units_l0': 56, 'dropout_l0': 0.39703360133152643, 'activation_l1': 'elu', 'n_units_l1': 13, 'dropout_l1': 0.3661746003540569, 'activation_l2': 'tanh', 'n_units_l2': 39, 'dropout_l2': 0.3175586333400158}. Best is trial 29 with value: 0.9599999785423279.
[I 2025-03-20 16:07:55,166] Trial 45 finished with value: 0.8799999952316284 and parameters: {'n_layers': 3, 'activation_l0': 'leaky_relu', 'n_units_l0': 35, 'dropout_l0': 0.30682736139055744, 'activation_l1': 'leaky_relu', 'n_units_l1': 10, 'dropout_l1': 0.4261503304291069, 'activation_l2': 'selu', 'n_units_l2': 15, 'dropout_l2': 0.3892599559927012}. Best is trial 29 with value: 0.9599999785423279.
[I 2025-03-20 16:08:08,258] Trial 46 finished with value: 0.8799999952316284 and parameters: {'n_layers': 3, 'activation_l0': 'tanh', 'n_units_l0': 17, 'dropout_l0': 0.24296168619382905, 'activation_l1': 'selu', 'n_units_l1': 6, 'dropout_l1': 0.2957367091137728, 'activation_l2': 'leaky_relu', 'n_units_l2': 10, 'dropout_l2': 0.2876828592178597}. Best is trial 29 with value: 0.9599999785423279.
[I 2025-03-20 16:08:16,929] Trial 47 pruned. Trial was pruned at epoch 30.
[I 2025-03-20 16:08:33,209] Trial 48 finished with value: 0.8999999761581421 and parameters: {'n_layers': 3, 'activation_l0': 'leaky_relu', 'n_units_l0': 126, 'dropout_l0': 0.33684790072461945, 'activation_l1': 'elu', 'n_units_l1': 8, 'dropout_l1': 0.35034759279920574, 'activation_l2': 'selu', 'n_units_l2': 5, 'dropout_l2': 0.4662636484465381}. Best is trial 29 with value: 0.9599999785423279.
[I 2025-03-20 16:08:39,658] Trial 49 pruned. Trial was pruned at epoch 10.
[I 2025-03-20 16:08:49,724] Trial 50 pruned. Trial was pruned at epoch 30.
[I 2025-03-20 16:09:00,307] Trial 51 finished with value: 0.8600000143051147 and parameters: {'n_layers': 2, 'activation_l0': 'tanh', 'n_units_l0': 5, 'dropout_l0': 0.4649223595804014, 'activation_l1': 'tanh', 'n_units_l1': 19, 'dropout_l1': 0.4367962564454893}. Best is trial 29 with value: 0.9599999785423279.
[I 2025-03-20 16:09:10,819] Trial 52 finished with value: 0.8600000143051147 and parameters: {'n_layers': 2, 'activation_l0': 'tanh', 'n_units_l0': 4, 'dropout_l0': 0.44973521510798165, 'activation_l1': 'tanh', 'n_units_l1': 31, 'dropout_l1': 0.44982848765789174}. Best is trial 29 with value: 0.9599999785423279.
[I 2025-03-20 16:09:21,221] Trial 53 finished with value: 0.8399999737739563 and parameters: {'n_layers': 2, 'activation_l0': 'tanh', 'n_units_l0': 7, 'dropout_l0': 0.4925492695981202, 'activation_l1': 'selu', 'n_units_l1': 18, 'dropout_l1': 0.42934562415300825}. Best is trial 29 with value: 0.9599999785423279.
[I 2025-03-20 16:09:31,564] Trial 54 finished with value: 0.8999999761581421 and parameters: {'n_layers': 2, 'activation_l0': 'tanh', 'n_units_l0': 29, 'dropout_l0': 0.46374058621967107, 'activation_l1': 'selu', 'n_units_l1': 42, 'dropout_l1': 0.46431903937003827}. Best is trial 29 with value: 0.9599999785423279.
[I 2025-03-20 16:09:37,012] Trial 55 pruned. Trial was pruned at epoch 10.
[I 2025-03-20 16:09:42,612] Trial 56 pruned. Trial was pruned at epoch 10.
[I 2025-03-20 16:09:52,055] Trial 57 finished with value: 0.8999999761581421 and parameters: {'n_layers': 2, 'activation_l0': 'leaky_relu', 'n_units_l0': 50, 'dropout_l0': 0.4742782938422399, 'activation_l1': 'elu', 'n_units_l1': 120, 'dropout_l1': 0.3789902714912463}. Best is trial 29 with value: 0.9599999785423279.
[I 2025-03-20 16:10:09,125] Trial 58 finished with value: 0.8799999952316284 and parameters: {'n_layers': 3, 'activation_l0': 'tanh', 'n_units_l0': 10, 'dropout_l0': 0.4014956711281331, 'activation_l1': 'selu', 'n_units_l1': 12, 'dropout_l1': 0.3603791410387398, 'activation_l2': 'relu', 'n_units_l2': 9, 'dropout_l2': 0.30342198234329065}. Best is trial 29 with value: 0.9599999785423279.
[I 2025-03-20 16:10:20,984] Trial 59 finished with value: 0.9200000166893005 and parameters: {'n_layers': 2, 'activation_l0': 'leaky_relu', 'n_units_l0': 6, 'dropout_l0': 0.2001870039515361, 'activation_l1': 'tanh', 'n_units_l1': 50, 'dropout_l1': 0.48625975592028925}. Best is trial 29 with value: 0.9599999785423279.
[I 2025-03-20 16:10:27,195] Trial 60 pruned. Trial was pruned at epoch 10.
[I 2025-03-20 16:10:38,977] Trial 61 finished with value: 0.8999999761581421 and parameters: {'n_layers': 2, 'activation_l0': 'tanh', 'n_units_l0': 4, 'dropout_l0': 0.4384601179118288, 'activation_l1': 'tanh', 'n_units_l1': 16, 'dropout_l1': 0.4251205970007938}. Best is trial 29 with value: 0.9599999785423279.
[I 2025-03-20 16:10:49,698] Trial 62 finished with value: 0.8399999737739563 and parameters: {'n_layers': 2, 'activation_l0': 'tanh', 'n_units_l0': 5, 'dropout_l0': 0.42550039013278346, 'activation_l1': 'tanh', 'n_units_l1': 20, 'dropout_l1': 0.4064867311643671}. Best is trial 29 with value: 0.9599999785423279.
[I 2025-03-20 16:11:02,551] Trial 63 finished with value: 0.8999999761581421 and parameters: {'n_layers': 2, 'activation_l0': 'tanh', 'n_units_l0': 4, 'dropout_l0': 0.4578762242895817, 'activation_l1': 'tanh', 'n_units_l1': 14, 'dropout_l1': 0.4312023692943297}. Best is trial 29 with value: 0.9599999785423279.
[I 2025-03-20 16:11:17,122] Trial 64 finished with value: 0.8999999761581421 and parameters: {'n_layers': 2, 'activation_l0': 'tanh', 'n_units_l0': 32, 'dropout_l0': 0.4108957427705136, 'activation_l1': 'tanh', 'n_units_l1': 9, 'dropout_l1': 0.39334926821992006}. Best is trial 29 with value: 0.9599999785423279.
[I 2025-03-20 16:11:27,437] Trial 65 finished with value: 0.8600000143051147 and parameters: {'n_layers': 2, 'activation_l0': 'selu', 'n_units_l0': 24, 'dropout_l0': 0.4440814032208358, 'activation_l1': 'selu', 'n_units_l1': 7, 'dropout_l1': 0.31032285582988967}. Best is trial 29 with value: 0.9599999785423279.
[I 2025-03-20 16:11:35,303] Trial 66 pruned. Trial was pruned at epoch 14.
[I 2025-03-20 16:11:41,819] Trial 67 pruned. Trial was pruned at epoch 10.
[I 2025-03-20 16:11:48,473] Trial 68 pruned. Trial was pruned at epoch 10.
[I 2025-03-20 16:11:59,764] Trial 69 finished with value: 0.8999999761581421 and parameters: {'n_layers': 3, 'activation_l0': 'elu', 'n_units_l0': 6, 'dropout_l0': 0.39108918389641717, 'activation_l1': 'elu', 'n_units_l1': 28, 'dropout_l1': 0.4183460968571921, 'activation_l2': 'leaky_relu', 'n_units_l2': 31, 'dropout_l2': 0.37992511673572}. Best is trial 29 with value: 0.9599999785423279.
[I 2025-03-20 16:12:14,362] Trial 70 finished with value: 0.8999999761581421 and parameters: {'n_layers': 3, 'activation_l0': 'leaky_relu', 'n_units_l0': 90, 'dropout_l0': 0.36490320701936124, 'activation_l1': 'selu', 'n_units_l1': 11, 'dropout_l1': 0.32529521483495466, 'activation_l2': 'elu', 'n_units_l2': 85, 'dropout_l2': 0.211898555304848}. Best is trial 29 with value: 0.9599999785423279.
[I 2025-03-20 16:12:22,341] Trial 71 pruned. Trial was pruned at epoch 14.
[I 2025-03-20 16:12:29,780] Trial 72 pruned. Trial was pruned at epoch 14.
[I 2025-03-20 16:12:42,551] Trial 73 finished with value: 0.8600000143051147 and parameters: {'n_layers': 2, 'activation_l0': 'tanh', 'n_units_l0': 11, 'dropout_l0': 0.4555369956023275, 'activation_l1': 'tanh', 'n_units_l1': 69, 'dropout_l1': 0.35920079625226153}. Best is trial 29 with value: 0.9599999785423279.
[I 2025-03-20 16:12:53,735] Trial 74 finished with value: 0.8600000143051147 and parameters: {'n_layers': 2, 'activation_l0': 'tanh', 'n_units_l0': 7, 'dropout_l0': 0.47503757499775784, 'activation_l1': 'tanh', 'n_units_l1': 17, 'dropout_l1': 0.20069524695638286}. Best is trial 29 with value: 0.9599999785423279.
[I 2025-03-20 16:13:04,335] Trial 75 finished with value: 0.8799999952316284 and parameters: {'n_layers': 2, 'activation_l0': 'leaky_relu', 'n_units_l0': 13, 'dropout_l0': 0.417095482354619, 'activation_l1': 'leaky_relu', 'n_units_l1': 14, 'dropout_l1': 0.38136603532097346}. Best is trial 29 with value: 0.9599999785423279.
[I 2025-03-20 16:13:18,278] Trial 76 finished with value: 0.8600000143051147 and parameters: {'n_layers': 3, 'activation_l0': 'selu', 'n_units_l0': 9, 'dropout_l0': 0.4856757824147194, 'activation_l1': 'selu', 'n_units_l1': 13, 'dropout_l1': 0.36832702822344143, 'activation_l2': 'tanh', 'n_units_l2': 36, 'dropout_l2': 0.25287187835017194}. Best is trial 29 with value: 0.9599999785423279.
[I 2025-03-20 16:13:30,936] Trial 77 finished with value: 0.9200000166893005 and parameters: {'n_layers': 2, 'activation_l0': 'tanh', 'n_units_l0': 27, 'dropout_l0': 0.22795782935517367, 'activation_l1': 'elu', 'n_units_l1': 25, 'dropout_l1': 0.39037408162881204}. Best is trial 29 with value: 0.9599999785423279.
[I 2025-03-20 16:13:38,259] Trial 78 pruned. Trial was pruned at epoch 10.
[I 2025-03-20 16:13:51,319] Trial 79 finished with value: 0.9399999976158142 and parameters: {'n_layers': 3, 'activation_l0': 'leaky_relu', 'n_units_l0': 40, 'dropout_l0': 0.4474591731790712, 'activation_l1': 'tanh', 'n_units_l1': 6, 'dropout_l1': 0.40214779517210064, 'activation_l2': 'elu', 'n_units_l2': 5, 'dropout_l2': 0.34915717140362007}. Best is trial 29 with value: 0.9599999785423279.
[I 2025-03-20 16:14:03,565] Trial 80 finished with value: 0.8799999952316284 and parameters: {'n_layers': 3, 'activation_l0': 'leaky_relu', 'n_units_l0': 39, 'dropout_l0': 0.40391499396939634, 'activation_l1': 'tanh', 'n_units_l1': 5, 'dropout_l1': 0.4332558177787037, 'activation_l2': 'elu', 'n_units_l2': 5, 'dropout_l2': 0.34986532534516823}. Best is trial 29 with value: 0.9599999785423279.
[I 2025-03-20 16:14:15,169] Trial 81 finished with value: 0.9200000166893005 and parameters: {'n_layers': 3, 'activation_l0': 'leaky_relu', 'n_units_l0': 44, 'dropout_l0': 0.4684652905259494, 'activation_l1': 'tanh', 'n_units_l1': 6, 'dropout_l1': 0.40028897120252127, 'activation_l2': 'elu', 'n_units_l2': 5, 'dropout_l2': 0.27588803152102587}. Best is trial 29 with value: 0.9599999785423279.
